input,answers,context_id
How does the book describe the process of quantum simulation?,"The book describes quantum simulation as a process where a quantum computer maps the pieces of a quantum system onto qubits and simulates their interactions using quantum logic operations, allowing for efficient and accurate modeling of quantum dynamics.",7d29a936f0ff1114a40ff8fc0420568c
What is the escape velocity and how is it calculated?,"The escape velocity is the minimum velocity required for an object to escape from the gravitational influence of a massive body. It is calculated using the formula \( v = \sqrt{2GM/R} \), where \( G \) is the gravitational constant, \( M \) is the mass of the body, and \( R \) is the distance from the center of the body.",50d0e98cd6d39da391bbc6763e5ee1e7
"What is supersymmetry, and how does it relate to the standard model of particle physics?","Supersymmetry is a theoretical extension of the standard model of particle physics, proposing that every known particle has an as-yet-undiscovered superpartner with different properties. This theory could explain the existence of exotic dark matter and provide insights into the early universe's conditions shortly after the big bang.",12106a4acd53251e4e29f9062d7fe9d1
What is the role of entropy in the universe according to the book?,"Entropy is described as a measure of information that is invisible to us, or ignorance. It increases as information spreads and is a fundamental aspect of the second law of thermodynamics.",7d29a936f0ff1114a40ff8fc0420568c
How did Galileo Galilei contribute to the understanding of falling bodies?,Galileo discovered that the velocity of free fall does not depend on the mass of the falling body and that the distances covered by a moving object increase as the squares of the time of travel.,50d0e98cd6d39da391bbc6763e5ee1e7
How does the author explain the concept of self-reference in the context of consciousness?,"The author explains self-reference in the context of consciousness as the system's capacity to see itself separate from the world. This is crucial in quantum measurement, where the observer is part of the system being observed, leading to a tangled hierarchy where the observer and the observed are interdependent.",a319da94c22b8cd0c892e7211032d392
What is the principle behind optical coherence tomography (OCT)?,"The principle behind optical coherence tomography (OCT) is based on the Michelson interferometer, where light from a superluminescent diode is split into a sample and a reference path. The interference pattern between the light scattered back from the tissue and the reference beam is used to create high-resolution images of the tissue.",8c17dccdcecf806604208a748c4f906f
What is the role of consciousness in the author's interpretation of quantum mechanics?,"In the author's interpretation of quantum mechanics, consciousness plays a crucial role in collapsing the wave function of quantum objects, thereby determining their observed states. This interpretation posits that consciousness is nonlocal and unitive, and that it is the observer's consciousness that resolves the paradoxes of quantum physics.",a319da94c22b8cd0c892e7211032d392
What role does darkness play in the universe according to the book?,"According to the book, darkness plays a crucial role in the universe by allowing for optimal visibility and the protection of life from harmful radiation, with Earth situated in one of the darkest regions of the cosmos where life is possible.",96e21db8fb4adbc44afb95b2e07e8bde
How did Gödel's health and mental state impact his life and work?,"Gödel suffered from various health issues, including bouts of depression and an eating disorder that eventually led to his death. His mental state was also marked by paranoia and a deep mistrust of doctors. These conditions significantly affected his personal life and ability to work consistently.",4a53b5e320c5ac112fd55f4427271e1e
What is the significance of the k-space matrix in MRI?,The k-space matrix in MRI is a frequency-domain representation of the image. Filling the k-space matrix with data from different phase encode gradients allows for the reconstruction of the image through inverse Fourier transform.,8c17dccdcecf806604208a748c4f906f
What are the three laws of planetary motion proposed by Johannes Kepler?,Kepler's three laws are: 1) The orbits of planets are ellipses with the Sun at one of the two foci. 2) A line joining a planet and the Sun sweeps out equal areas during equal intervals of time. 3) The square of the orbital period of a planet is directly proportional to the cube of the semi-major axis of its orbit.,50d0e98cd6d39da391bbc6763e5ee1e7
How did Gödel and Einstein first meet and become friends?,"Gödel and Einstein first met at the Institute for Advanced Study in Princeton. They became friends in 1942 and remained close until Einstein's death in 1955. Their friendship was characterized by long walks and discussions on various topics, including politics, philosophy, and physics.",4a53b5e320c5ac112fd55f4427271e1e
"What is the central thesis of ""The Self-Aware Universe"" by Amit Goswami?","The central thesis of ""The Self-Aware Universe"" is that consciousness, not matter, is the ground of all being, and that modern science validates this ancient idea. The book proposes a new paradigm that integrates mind and spirit into science, based on the recognition that quantum physics supports a philosophy of monistic idealism.",a319da94c22b8cd0c892e7211032d392
What is the principle of superposition of motion?,"The principle of superposition of motion states that if an object undergoes several successive displacements, each described by a corresponding displacement vector, the final position can be described by a single displacement vector which is the sum of the original displacement vectors.",50d0e98cd6d39da391bbc6763e5ee1e7
What is the significance of iterative reconstruction methods in SPECT and PET?,"Iterative reconstruction methods in SPECT and PET are significant because they can optimize the balance between detail and artifactual texture in the reconstructed images. These methods can also account for the Poisson noise characteristic of nuclear imaging data, leading to improved image quality.",8c17dccdcecf806604208a748c4f906f
How does the curvature of space-time affect the motion of light and planets?,"According to Einstein's theory of gravity, the curvature of space-time caused by mass and energy affects the motion of light and planets, causing them to follow geodesics (the shortest paths in curved space) rather than straight lines.",50d0e98cd6d39da391bbc6763e5ee1e7
"Who is Charles Seife, and what is his background?","Charles Seife is a journalist who holds a master's degree in mathematics from Yale University. He writes for Science magazine and has also written for New Scientist, Scientific American, The Economist, Wired, The Sciences, and many other publications. His previous book, ""Zero,"" won the PEN/Martha Albrand Award for first nonfiction book and was named a New York Times Notable Book.",12106a4acd53251e4e29f9062d7fe9d1
"What is the central problem facing science according to Lee Smolin in ""Time Reborn""?","The central problem facing science, as described by Lee Smolin, is understanding the nature of time. All mysteries in physics and cosmology, from the Big Bang to the future of the universe, from quantum physics to the unification of forces and particles, ultimately come down to the nature of time.",0b3c203d0200e36d441caf1833c8b359
How does the Moon affect Earth's tides?,"The Moon affects Earth's tides through its gravitational pull. This pull creates a tidal bulge in the oceans, causing the water level to rise on the side of Earth facing the Moon and on the opposite side. As Earth rotates, these tidal bulges move, resulting in the daily cycle of tides.",08070dadebd8208d9c0604e3d55b3dbb
What is the significance of the Cavendish balance in the study of gravity?,"The Cavendish balance was used to demonstrate the existence of gravitational attraction between everyday-sized bodies, providing direct experimental proof of Newton's Law of Universal Gravity.",50d0e98cd6d39da391bbc6763e5ee1e7
"What is the significance of the discovery of dark energy, and how does it affect our understanding of the universe's expansion?","The discovery of dark energy, which makes up about 68% of the universe's mass-energy content, was significant because it explained the observed accelerated expansion of the universe. This discovery challenged previous understandings that the universe's expansion should be slowing down due to gravity and instead showed that there is an unknown force driving the expansion to accelerate.",7dc0f11a13ab6e1fe2b019ed154d79cc
"What is dark matter, and why is it considered a mystery in cosmology?","Dark matter is a type of matter that does not emit light or radiation and is therefore invisible to telescopes. It is considered a mystery because it makes up about 27% of the universe's mass-energy content, but its exact nature and composition are unknown.",7dc0f11a13ab6e1fe2b019ed154d79cc
How does Einstein's theory of relativity challenge the concept of time?,"Einstein's theory of relativity challenges the concept of time by suggesting that time is not absolute but relative, and that the experience of time is dependent on the observer's motion and position. Special relativity introduces the concept of the relativity of simultaneity, where different observers may disagree about whether two events are simultaneous. General relativity further complicates this by suggesting that time can be curved and influenced by matter and energy, leading to the concept of a block universe where past, present, and future are all equally real.",0b3c203d0200e36d441caf1833c8b359
What is the primary goal of the Large Hadron Collider (LHC)?,"The primary goal of the LHC is to perform detailed studies of the structure of matter at distances never before measured and at energies higher than have ever been explored before, generating exotic fundamental particles and revealing interactions that occurred early in the universe's evolution.",250200c2919a4d5358285a0ee171d54c
What is the concept of molecular imaging in the context of radionuclide imaging?,Molecular imaging in the context of radionuclide imaging involves using radiolabeled antibodies or other markers that specifically interact with targeted proteins or cellular processes. This allows for the visualization and study of functional processes at the cellular and subcellular scale.,8c17dccdcecf806604208a748c4f906f
What is the law of gravitation according to the book?,"The law of gravitation, as explained in the book, states that any two objects exert an attractive force on each other, given by the formula \( F_{\text{grav}} = \frac{Gm_1m_2}{r^2} \), where \( G \) is the gravitational constant, and \( m_1 \) and \( m_2 \) are the masses of the objects, and \( r \) is the distance between their centers.",a630d3efde510336e7170839db41131a
"How does the author explain the concept of ""spooky action at a distance""?","The author explains ""spooky action at a distance"" as a phenomenon where entangled particles seem to affect each other instantaneously over distances, but this does not imply faster-than-light communication because the outcomes remain probabilistic until measured.",7d29a936f0ff1114a40ff8fc0420568c
How did Einstein's theory of relativity challenge Newtonian mechanics?,"Einstein's theory of relativity challenged Newtonian mechanics by asserting that no material body could move with the velocity of light, a conclusion that contradicted Newton's law of force, which allowed for the gradual acceleration of a mass until it attained the speed of light with a sufficient force acting on it for a long enough time.",f675deb55a454dba15b9a5fb47e7d8a7
What role did Maxwell play in the establishment of the Cavendish Laboratory at Cambridge University?,"Maxwell was instrumental in the establishment of the Cavendish Laboratory, serving as its first professor of experimental physics. He was involved in designing the laboratory to meet the highest standards of research and education, and he fostered an environment that encouraged independent research and the development of young scientists.",015dfec3d42bb4dd0607b2f89cb75fdf
"What is an Einstein ring, and how is it formed?","An Einstein ring is a ring-shaped image formed when the light from a distant source (like a galaxy) is perfectly aligned with a massive object (like a galaxy cluster) and the observer on Earth. The massive object's gravitational field bends the light into a circular path, creating the ring.",661e43f2fc345ba4793979e2e140b733
What is the significance of the double-slit experiment in understanding quantum mechanics?,"The double-slit experiment demonstrates the wave-particle duality of particles, showing that they can exist in multiple states simultaneously, a key concept in quantum mechanics.",7d29a936f0ff1114a40ff8fc0420568c
What is the significance of the precession of the Earth's axis?,"The precession of the Earth's axis causes the axis to describe a conical surface in space, leading to changes in the dates of equinoxes and the orientation of the Earth relative to the Sun, which affects climate patterns.",50d0e98cd6d39da391bbc6763e5ee1e7
What is the significance of the Andromeda Galaxy in relation to Earth?,"The Andromeda Galaxy is significant because it is our nearest major galactic neighbor, located about 2.5 million light-years away. It is also on a collision course with the Milky Way, and the eventual merger of these two galaxies will have profound effects on both.",08070dadebd8208d9c0604e3d55b3dbb
How does Special Relativity resolve the apparent paradox of the twin paradox?,"Special Relativity resolves the twin paradox by noting that the traveling twin experiences acceleration and deceleration, which breaks the symmetry of the situation. The traveling twin's frame is not inertial throughout the journey, whereas the stay-at-home twin's frame is inertial. This asymmetry accounts for the difference in aging between the twins.",0cd4599980351308ae84fcf6cfb14dd6
"What was the significance of Maxwell's work on the kinetic theory of gases, and what new concepts did he introduce?","Maxwell's work on the kinetic theory of gases introduced the concept of statistical mechanics into physics, explaining the behavior of gases in terms of the motion and interaction of their molecules. He derived the Maxwell distribution of molecular velocities, which was a groundbreaking use of statistical methods to describe physical phenomena.",015dfec3d42bb4dd0607b2f89cb75fdf
How does the book describe the behavior of objects in free fall?,"The book describes objects in free fall as experiencing only the force of gravity, leading to a constant downward acceleration of approximately \( 9.8 \, \text{m/s}^2 \).",a630d3efde510336e7170839db41131a
How did the discovery of gravitational lensing confirm Einstein's theory of general relativity?,"The confirmation came in 1919 during a solar eclipse when Sir Arthur Eddington observed that stars near the Sun appeared shifted from their usual positions. This shift was due to the bending of light by the Sun's mass, as predicted by Einstein's theory.",661e43f2fc345ba4793979e2e140b733
What is the significance of the ratio of electrostatic to gravitational forces between two particles?,"The ratio of electrostatic to gravitational forces between two particles is extremely large (about 10^40), highlighting the vast difference in strength between these two fundamental forces. This ratio is significant for understanding the relative influence of these forces in various physical phenomena.",50d0e98cd6d39da391bbc6763e5ee1e7
"What are the two main ""knobs"" that influence the emitted radiation in an X-ray tube?","The two main ""knobs"" that influence the emitted radiation in an X-ray tube are the anode voltage and the tube current. Increasing the anode voltage increases the maximum energy of the X-ray photons and the total number of photons emitted, while increasing the tube current increases the X-ray photon flux without changing the highest energy of the emitted photons.",8c17dccdcecf806604208a748c4f906f
"What are the two main categories of dark matter, and what do they consist of?","The two main categories of dark matter are MACHOs (Massive Astrophysical Compact Halo Objects) and WIMPs (Weakly Interacting Massive Particles). MACHOs include dim stars, black holes, and planets, while WIMPs are hypothetical particles that interact very weakly with normal matter.",661e43f2fc345ba4793979e2e140b733
What role did the sextant play in the evolution of navigation?,"The sextant allowed for more accurate measurements of celestial bodies, enabling navigators to determine their latitude and, later, their longitude, thereby improving the precision of navigation at sea.",30c7d34938922b1b23c889694b9955a2
What is the primary purpose of a beam-hardening filter in an X-ray tube assembly?,"The primary purpose of a beam-hardening filter in an X-ray tube assembly is to absorb some of the low-energy radiation, which helps to reduce the patient dose and minimize artifacts in computed tomography.",8c17dccdcecf806604208a748c4f906f
How did Gödel's friendship with Einstein influence his work on relativity theory?,"Gödel's friendship with Einstein provided him with insights into the philosophical and conceptual foundations of relativity theory. This influenced his work on relativity by allowing him to explore the deeper implications of the theory, leading to his discovery of the rotating universe solution and his philosophical reflections on the nature of time.",4a53b5e320c5ac112fd55f4427271e1e
"What is the main goal of ""The MCAT Physics Book""?","The main goal of ""The MCAT Physics Book"" is to review basic physics with an emphasis on principles and ideas, and to help students learn to approach new situations and think about them with a physics mindset, preparing them for the physics portion of the MCAT.",a630d3efde510336e7170839db41131a
What is the role of gravity in the formation of mountains?,Gravity plays a crucial role in the formation of mountains by pulling together the Earth's crust and mantle materials. The pressure and forces exerted by gravity can cause these materials to rise and form mountain ranges.,08070dadebd8208d9c0604e3d55b3dbb
"What role did the concept of ""ether"" play in the development of Einstein's theory of relativity?","The concept of ""ether"" was problematic in the development of Einstein's theory of relativity because Michelson's experiment, which attempted to measure the velocity of the earth through the ether, yielded a null result, suggesting that the ether theory of light was erroneous. Einstein abandoned the assumption that light is a process in the ether medium, leading to the development of his theory of relativity.",f675deb55a454dba15b9a5fb47e7d8a7
"What is the significance of the Hubble constant, and how is it measured?","The Hubble constant is a measure of the current rate of expansion of the universe. It is significant because it helps determine the age and ultimate fate of the universe. It is measured using various methods, including observing distant supernovae and the cosmic microwave background, as well as studying the motions of galaxies and the distribution of matter in the universe.",12106a4acd53251e4e29f9062d7fe9d1
What is dark matter and why is it significant?,"Dark matter is a form of matter that does not emit or absorb light but exerts gravitational influence, making up about 23% of the universe's energy density. It is significant because it helps explain the formation and structure of galaxies and other large-scale structures.",250200c2919a4d5358285a0ee171d54c
How does the Earth's rotation affect our weight?,"The Earth's rotation affects our weight by creating a centrifugal force that slightly reduces the gravitational pull at the equator. This results in a variation in weight, with people weighing slightly less at the equator compared to the poles.",08070dadebd8208d9c0604e3d55b3dbb
How does Claude Shannon's information theory revolutionize the understanding of information?,"Claude Shannon's information theory revolutionized the understanding of information by providing a mathematical framework to measure and quantify information, establishing information as a tangible, measurable property akin to mass or energy. This theory laid the groundwork for modern communication systems and the digital age.",ee660b723be02906f4b54e5057dabf98
How does the LHC contribute to the search for dark matter?,"The LHC contributes to the search for dark matter by potentially creating particles that could be the dark matter candidates, given that these particles are stable, have the right mass, and interact weakly with ordinary matter, matching the characteristics of dark matter.",250200c2919a4d5358285a0ee171d54c
What is the concept of antigravity and why is it considered speculative?,"Antigravity refers to the hypothetical idea of shielding or negating gravitational forces. It is considered speculative because there is no known material or mechanism that can effectively shield or reverse gravitational attraction, and the existence of particles with negative gravitational mass remains unconfirmed.",50d0e98cd6d39da391bbc6763e5ee1e7
How did the development of the magnetic compass impact maritime navigation?,"The development of the magnetic compass allowed mariners to determine direction at sea, which was crucial for long-distance navigation and reducing the reliance on land-based references.",30c7d34938922b1b23c889694b9955a2
How does the LHC probe smaller distances and higher energies?,"The LHC probes smaller distances and higher energies by accelerating protons to extremely high energies and then colliding them together, using quantum mechanics principles that connect high energies with short wavelengths and small distances.",250200c2919a4d5358285a0ee171d54c
How does the book define acceleration in one dimension?,"In one dimension, the book defines acceleration as the change in velocity per unit time, given by the formula \( a = \frac{\Delta v}{\Delta t} \).",a630d3efde510336e7170839db41131a
How does quantum computation differ from classical computation?,"Quantum computation differs from classical computation in that quantum bits (qubits) can exist in superpositions of states, allowing quantum computers to perform multiple computations simultaneously through quantum parallelism.",7d29a936f0ff1114a40ff8fc0420568c
How does the Higgs mechanism explain the masses of elementary particles?,"The Higgs mechanism explains the masses of elementary particles by proposing a phase transition in the early universe involving the Higgs field, which changed particles from having zero mass to acquiring their measured masses.",250200c2919a4d5358285a0ee171d54c
What is the significance of the double-slit experiment in quantum physics?,"The double-slit experiment in quantum physics demonstrates the wave-particle duality of quantum objects, such as electrons. It shows that these objects exhibit both wave-like and particle-like behavior, depending on how they are observed, highlighting the inseparability of the observer and the observed in quantum mechanics.",a319da94c22b8cd0c892e7211032d392
How does quantum physics challenge our understanding of locality?,"Quantum physics challenges our understanding of locality by demonstrating that objects can be entangled, meaning their properties are correlated regardless of the distance between them. This contradicts the classical notion that physical influences propagate continuously from one point to the next.",3b2c0239fe49fa975bf082073cb7d04a
How do microlensing experiments help in the search for MACHOs?,"Microlensing experiments involve monitoring the brightness of stars in nearby galaxies like the Large Magellanic Cloud. When a MACHO passes in front of a star, it acts as a lens and temporarily magnifies the star's brightness, which can be detected and analyzed to infer the presence of MACHOs.",661e43f2fc345ba4793979e2e140b733
How does Einstein's Special Theory of Relativity affect the concept of time?,"Einstein's Special Theory of Relativity suggests that time can slow down or speed up depending on the relative motion of observers and their proximity to gravitational fields, leading to phenomena like time dilation.",50d0e98cd6d39da391bbc6763e5ee1e7
How does Smolin's theory of cosmological natural selection differ from the anthropic principle?,"Smolin's theory of cosmological natural selection posits that universes reproduce by forming new universes inside black holes, and that the laws of physics evolve over time through a process similar to biological natural selection. This theory differs from the anthropic principle, which suggests that we find ourselves in a universe that is hospitable to life because such a universe is necessary for our existence. Cosmological natural selection provides a mechanism for the evolution of laws, while the anthropic principle is more of a selection principle without a clear mechanism for how laws or conditions become life-friendly.",0b3c203d0200e36d441caf1833c8b359
What is the role of the Fourier transform in magnetic resonance imaging (MRI)?,The Fourier transform plays a crucial role in MRI by allowing the reconstruction of a cross-sectional image from one-dimensional Fourier-encoded information. It is used to convert the raw data collected from the MRI scanner into an image that can be interpreted by medical professionals.,8c17dccdcecf806604208a748c4f906f
