input,answers,context_id
How did Gödel's philosophical views differ from those of the Vienna Circle?,"Gödel's philosophical views were markedly different from those of the Vienna Circle, which was dominated by logical positivism. Gödel was a mathematical realist and believed in the objective existence of mathematical truths, whereas the Vienna Circle emphasized empirical verification and rejected metaphysical speculation.",4a53b5e320c5ac112fd55f4427271e1e
What are the three major developments in the medical field over the past two centuries that the author considers particularly outstanding?,"The three major developments are the discovery of antibiotics in the late nineteenth century, the discovery of anesthesia during the late eighteenth century to the mid-1800s, and the discovery of methods to look inside the human body without surgery, with biomedical imaging being the youngest of these developments.",8c17dccdcecf806604208a748c4f906f
What are the two fundamental postulates of Special Relativity?,"The two fundamental postulates of Special Relativity are: 1) The Principle of Relativity, which states that the laws of physics are the same in all inertial reference frames, and 2) The Constancy of the Speed of Light, which asserts that the speed of light in a vacuum is the same for all observers, regardless of their motion or the motion of the light source.",0cd4599980351308ae84fcf6cfb14dd6
What was the significance of Gödel's rotating universe solution to Einstein's field equations?,"Gödel's rotating universe solution demonstrated the existence of closed timelike curves, which implied the possibility of time travel. This discovery was significant because it challenged the conventional understanding of time in relativity theory and raised profound philosophical questions about the nature of time.",4a53b5e320c5ac112fd55f4427271e1e
What is the significance of Bell's theorem and Aspect's experiment in the book?,"Bell's theorem and Aspect's experiment are significant in the book as they provide empirical evidence for quantum nonlocality, demonstrating that correlated quantum objects can influence each other instantaneously across distances, thus challenging the principles of locality and material realism.",a319da94c22b8cd0c892e7211032d392
"How are scientists attempting to detect dark matter, and what are the challenges involved?","Scientists are attempting to detect dark matter through various methods, including gravitational lensing, which uses the warping of light by massive objects to infer their presence, and direct detection experiments that look for rare interactions of dark matter particles (WIMPs) with matter in highly shielded detectors. The challenges include distinguishing signals from dark matter interactions among the background noise of other particles and phenomena.",12106a4acd53251e4e29f9062d7fe9d1
What is the definition of work in physics according to the book?,"In physics, work is defined by the book as the energy flowing into an object or system due to a force acting on it over a distance, given by the formula \( W = F \Delta x \cos \phi \), where \( F \) is the force, \( \Delta x \) is the displacement, and \( \phi \) is the angle between the force and the displacement.",a630d3efde510336e7170839db41131a
"What is the primary purpose of the book ""Reasons to Believe""?","The primary purpose of the book is to explore the hidden purposes of the universe's existence, structure, and history, providing insights into humanity's ultimate destiny and the value of human life.",96e21db8fb4adbc44afb95b2e07e8bde
What is the main misconception about scientists that the book addresses?,"The book addresses the misconception that scientists want everything to be neat and tidy, and that they don't want anyone questioning their ideas or suggesting that current explanations are incomplete. The book clarifies that scientists actually find mysteries and puzzles exciting.",7dc0f11a13ab6e1fe2b019ed154d79cc
How does the spin-echo pulse sequence in MRI help in determining tissue parameters?,"The spin-echo pulse sequence in MRI helps in determining tissue parameters such as T1 and T2 relaxation times and proton density. By varying the measurement times TE (echo time) and TR (repetition time), different contrasts can be achieved that highlight specific tissue characteristics.",8c17dccdcecf806604208a748c4f906f
Discuss the challenges Maxwell faced in his career and how he overcame them.,"Maxwell faced challenges such as skepticism from the scientific community about his electromagnetic theory, difficulties in securing academic positions, and the pressure of managing a new laboratory. He overcame these challenges through persistence, rigorous experimentation, and by fostering a supportive community of scientists who could carry on his work.",015dfec3d42bb4dd0607b2f89cb75fdf
What is the significance of the universe being 13.73 billion years old?,"The significance of the universe being 13.73 billion years old is that it represents the minimum time necessary to prepare a home for humanity, including the buildup of essential heavy elements and long-lived radioactive isotopes required for life.",96e21db8fb4adbc44afb95b2e07e8bde
What role did Galileo play in the development of modern scientific methods?,"Galileo played a crucial role in the development of modern scientific methods by pioneering indirect measurements, designing and using experiments to test hypotheses, and creating thought experiments to make predictions about phenomena that could not be directly observed.",250200c2919a4d5358285a0ee171d54c
What is the Law of Universal Gravity according to Isaac Newton?,The Law of Universal Gravity states that every two material objects attract each other with a force proportional to the product of their masses and inversely proportional to the square of the distance between them.,50d0e98cd6d39da391bbc6763e5ee1e7
"What is the central theme of ""Decoding the Universe"" by Charles Seife?","The central theme of ""Decoding the Universe"" is the exploration of how information theory governs the behavior of objects on different scales, from atoms to black holes, and how it ties together various theories in physics, including thermodynamics, relativity, and quantum mechanics.",ee660b723be02906f4b54e5057dabf98
How does the book address the potential loopholes in experimental demonstrations of quantum nonlocality?,"The book addresses potential loopholes such as the detection loophole and the locality loophole by discussing experimental techniques and advancements that aim to close these loopholes, ensuring the validity of the observed quantum nonlocality.",3b2c0239fe49fa975bf082073cb7d04a
What are the three cosmological revolutions mentioned in the book?,"The three cosmological revolutions are:
   - The Copernican revolution, which shattered the Aristotelian cosmos and placed the Earth not at the center of the universe but orbiting the sun.
   - Hubble's revolution, which revealed the vastness of the universe and its finite, expanding nature, leading to the concept of the big bang.
   - The current revolution, which is answering questions about the universe's origin and destiny through discoveries like supernovae and the cosmic microwave background.",12106a4acd53251e4e29f9062d7fe9d1
What role does angular momentum play in the motion of celestial bodies?,"Angular momentum is a conserved quantity in the motion of celestial bodies, meaning that the total angular momentum of a closed system remains constant. This principle is crucial in understanding the stability of orbits and the rotation of bodies in space.",50d0e98cd6d39da391bbc6763e5ee1e7
What is the significance of units in physics problems according to the book?,"The book emphasizes the importance of units in physics problems, stating that they can alert you if you have written an equation the wrong way, bring back to mind an equation you would have forgotten, and sometimes guide you to an answer without having to use a formula.",a630d3efde510336e7170839db41131a
What is the significance of Maxwell's demon in the book?,"Maxwell's demon is used to illustrate the concept that gaining information about a system can decrease its entropy, highlighting the relationship between information and thermodynamics.",7d29a936f0ff1114a40ff8fc0420568c
What is the significance of the discovery of a new extrasolar planet via gravitational lensing?,"The discovery of a new extrasolar planet via gravitational lensing, especially one as small as five times the mass of Earth, is significant because it demonstrates the technique's ability to detect planets that other methods might miss. It also extends our reach into the distant regions of the Universe.",661e43f2fc345ba4793979e2e140b733
How does Special Relativity impact the understanding of mass and energy?,"Special Relativity establishes a fundamental equivalence between mass and energy through the famous equation \(E = mc^2\). This equation shows that mass can be converted into energy and vice versa, and it has profound implications for nuclear reactions, particle physics, and the understanding of energy sources.",0cd4599980351308ae84fcf6cfb14dd6
How does relativity theory relate to the concept of information transfer?,"Relativity theory relates to the concept of information transfer by establishing a speed limit for the transfer of information, which is the speed of light. It also explains how different observers can gather contradictory information about the same event due to the relative motion and the distortion of space and time.",ee660b723be02906f4b54e5057dabf98
"What is the cosmological fallacy, and how does it relate to the limitations of the Newtonian paradigm?","The cosmological fallacy is the mistaken belief that a law or principle that works well for small parts of the universe can be extended to explain the universe as a whole. This fallacy relates to the limitations of the Newtonian paradigm because the paradigm, which is effective for small-scale systems, cannot be successfully applied to the entire universe without encountering unanswerable questions and paradoxes.",0b3c203d0200e36d441caf1833c8b359
What is the concept of simultaneity in Special Relativity?,"In Special Relativity, simultaneity is relative. Events that are simultaneous in one inertial reference frame may not be simultaneous in another frame moving relative to the first. This relativity of simultaneity is a consequence of the constancy of the speed of light and the Lorentz transformations.",0cd4599980351308ae84fcf6cfb14dd6
"What is the primary focus of ""Alpha & Omega: The Search for the Beginning and End of the Universe""?","The book primarily focuses on the scientific discoveries and the people behind them, aiming to answer eternal questions about the universe's origin and ultimate fate.",12106a4acd53251e4e29f9062d7fe9d1
How does Special Relativity affect the measurement of length?,"Special Relativity introduces the phenomenon of length contraction, where an object in motion relative to an observer appears shorter in the direction of motion than when it is at rest. This effect is also a result of the Lorentz transformations and is significant at speeds close to the speed of light.",0cd4599980351308ae84fcf6cfb14dd6
Why does Lee Smolin argue that time is real?,"Lee Smolin argues that time is real because contemporary developments in physics and cosmology suggest that time is the key to understanding quantum theory and its unification with space, time, gravity, and cosmology. He believes that embracing the reality of time is essential to make sense of the universe as observed by cosmological observations.",0b3c203d0200e36d441caf1833c8b359
"What is the anthropic principle, and how does it relate to the observed properties of the universe?","The anthropic principle states that the universe must have properties that allow for the existence of life, including human life, because we are here to observe it. It relates to the observed properties of the universe by suggesting that these properties are fine-tuned for life, and if they were significantly different, life as we know it would not exist.",7dc0f11a13ab6e1fe2b019ed154d79cc
How did Maxwell's views on the relationship between science and religion influence his work and personal philosophy?,Maxwell maintained a personal faith throughout his life and saw no conflict between his religious beliefs and scientific work. He believed that science and religion were complementary ways of understanding the world and that the results of scientific inquiry should be kept personal rather than being endorsed by religious or scientific institutions.,015dfec3d42bb4dd0607b2f89cb75fdf
How does the author resolve the paradox of Schrödinger's cat?,"The author resolves the paradox of Schrödinger's cat by proposing that it is observation by a conscious mind that resolves the alive-or-dead dichotomy. According to the idealist resolution, the cat's state is a coherent superposition of both alive and dead until observed, at which point the observer's consciousness collapses the superposition into one state.",a319da94c22b8cd0c892e7211032d392
What is the hierarchy problem in particle physics?,"The hierarchy problem in particle physics is the question of why the masses of elementary particles are so different from what quantum mechanical calculations would predict, requiring an enormous fine-tuning that suggests a more subtle underlying theory.",250200c2919a4d5358285a0ee171d54c
What is the significance of Maxwell's demon in the development of information theory?,"Maxwell's demon, a thought experiment by James Clerk Maxwell, challenged the second law of thermodynamics by suggesting a way to decrease entropy locally without expending energy, which seemed to contradict the laws of thermodynamics. The resolution of the paradox through information theory showed that information processing and entropy are intimately linked, leading to a deeper understanding of both concepts.",ee660b723be02906f4b54e5057dabf98
