input,answers,context_id
What are the challenges in constructing and operating the LHC?,"The challenges in constructing and operating the LHC include developing strong enough magnets, maintaining extremely low temperatures for superconducting magnets, achieving a high vacuum to protect the proton beams, and coordinating international collaborations for funding and participation.",250200c2919a4d5358285a0ee171d54c
What is the Big Bang theory and what evidence supports it?,"The Big Bang theory is the prevailing cosmological model for the origin of the Universe. Evidence supporting this theory includes the observed expansion of the Universe, the cosmic microwave background radiation, and the abundance of light elements like hydrogen and helium.",08070dadebd8208d9c0604e3d55b3dbb
What was the reaction of the scientific community to Gödel's cosmological solutions?,"The reaction of the scientific community to Gödel's cosmological solutions was initially one of skepticism and confusion. Some physicists questioned the physical realism of his models, while others were intrigued by the implications for the nature of time. Over time, however, Gödel's work has gained more recognition and has sparked ongoing discussions in the field of cosmology.",4a53b5e320c5ac112fd55f4427271e1e
How do stars create heavier elements?,"Stars create heavier elements through nuclear fusion reactions in their cores. These reactions start with hydrogen and gradually fuse heavier elements like helium, carbon, and oxygen. The process continues until iron is produced, at which point the star can no longer sustain fusion and may undergo a supernova explosion, creating even heavier elements.",08070dadebd8208d9c0604e3d55b3dbb
"How did Einstein's experience at the cantonal school in Aarau, Switzerland, differ from his time at the gymnasium in Munich?","At the cantonal school in Aarau, Einstein found a more liberal and progressive environment where teaching aimed at training students to think and work independently, unlike the regimented and mechanical drilling he experienced at the gymnasium in Munich.",f675deb55a454dba15b9a5fb47e7d8a7
How did the discovery of the cosmic microwave background (CMB) impact our understanding of the universe?,"The discovery of the CMB provided the first direct glimpse of the early universe, confirming the big bang theory and showing that the universe had a beginning. It is the faint afterglow of the big bang, a snapshot of a moment 400,000 years after the big bang, when all the matter in the cosmos was seething and glowing with the heat released from that cataclysm.",12106a4acd53251e4e29f9062d7fe9d1
What is the significance of the Hubble Ultra Deep Field image?,"The Hubble Ultra Deep Field image is significant because it captures thousands of galaxies, including some of the most distant objects ever seen. This image allows us to look back in time, as the light from these galaxies has traveled billions of years to reach us.",08070dadebd8208d9c0604e3d55b3dbb
"What is Bell's game, and why is it significant in the context of quantum physics?","Bell's game is a conceptual experiment used to test the predictions of quantum mechanics against local realism. It is significant because winning the game more often than allowed by classical physics implies the existence of nonlocal correlations, supporting the predictions of quantum mechanics.",3b2c0239fe49fa975bf082073cb7d04a
What technological advancements were necessary for the creation of accurate maps during the Age of Exploration?,"Technological advancements such as the development of the sextant, the magnetic compass, and improved shipbuilding techniques were necessary for the creation of accurate maps during the Age of Exploration, enabling more precise navigation and mapping of new territories.",30c7d34938922b1b23c889694b9955a2
What challenges did early navigators face in determining their longitude at sea?,"Early navigators faced significant challenges in determining their longitude at sea, primarily because it required an accurate measurement of time, which was difficult to achieve on a moving ship without precise clocks.",30c7d34938922b1b23c889694b9955a2
What are the philosophical implications of quantum nonlocality and true randomness?,"The philosophical implications of quantum nonlocality and true randomness challenge our classical notions of reality, determinism, and causality. They suggest that the universe operates on principles that are fundamentally different from our everyday experiences and classical intuitions.",3b2c0239fe49fa975bf082073cb7d04a
What is the primary connection we have with the Universe beyond our solar system?,"Light is the only connection we have with the Universe beyond our solar system. It allows us to observe distant stars and galaxies, and it carries information about the Universe's distant past.",08070dadebd8208d9c0604e3d55b3dbb
What was Maxwell's contribution to the development of color photography?,"Maxwell is credited with producing the world's first color photograph in 1861. He developed a method to capture three black-and-white photographs through red, green, and blue filters and then project them simultaneously using the same filters, resulting in a full-color image.",015dfec3d42bb4dd0607b2f89cb75fdf
What was Gödel's major mathematical contribution that shook the world of mathematics?,"Gödel's major mathematical contribution was his incompleteness theorem, which demonstrated that in any sufficiently powerful formal system of mathematics, there are statements that cannot be proven or disproven within that system. This result had profound implications for the foundations of mathematics and logic.",4a53b5e320c5ac112fd55f4427271e1e
What are the challenges faced in optical transillumination tomography?,"The challenges faced in optical transillumination tomography include the strong scattering properties of tissue, which require a very high dynamic range photodetector, and the issue of refractive index mismatch, which invalidates the straight-line assumption of the Radon transform.",8c17dccdcecf806604208a748c4f906f
How did Einstein's work on Brownian motion contribute to the field of physics?,"Einstein's work on Brownian motion provided a direct proof of the existence of molecules by showing that the average displacement of particles in Brownian motion increased as the square root of time, allowing the determination of the number of molecules in a unit volume through observation of the motion of visible particles.",f675deb55a454dba15b9a5fb47e7d8a7
How does the author justify the vastness of the universe?,"The author justifies the vastness of the universe by explaining that its size, mass, and visibility are precisely fine-tuned to support human life and allow for the observation and understanding of cosmic history.",96e21db8fb4adbc44afb95b2e07e8bde
What significant discovery about the universe did Vera Rubin make?,"Vera Rubin discovered that galaxies contain a large amount of dark matter, which is invisible but affects the rotation speeds of galaxies. This discovery was made by studying the motion of stars in galaxies and finding that the observed mass was insufficient to account for the observed rotation speeds.",7dc0f11a13ab6e1fe2b019ed154d79cc
What is the ultimate laptop according to the author's calculations?,"The ultimate laptop is a hypothetical computer with a mass of one kilogram and a volume of one liter, capable of performing an extremely high number of logical operations per second on a vast number of bits, limited only by the laws of physics.",7d29a936f0ff1114a40ff8fc0420568c
What is the block universe theory and how does it relate to the reality of time?,"The block universe theory is a concept derived from Einstein's theories of relativity, which posits that the entire history of the universe is fixed and unchangeable, like a block of space-time. In this view, time is just another dimension, and the distinction between past, present, and future is an illusion. This theory relates to the reality of time by suggesting that time is not a flow but a static structure, which challenges the common perception of time as a dynamic, unfolding process.",0b3c203d0200e36d441caf1833c8b359
"What was the initial offer that intrigued Palle Yourgrau to write ""A World Without Time""?","The initial offer was from William Frucht of Basic Books, who suggested that Yourgrau write a book accessible to normal readers, focusing on the intellectual drama of the companionship of Gödel and Einstein and placing their discoveries in the context of the great intellectual movements of the twentieth century.",4a53b5e320c5ac112fd55f4427271e1e
How does the book address the issue of cosmic decay and heat death?,"The book addresses cosmic decay and heat death by explaining that the accelerating expansion of the universe due to dark energy will eventually lead to the end of physical life and consciousness, but also suggests that hope and purpose may exist beyond the cosmos.",96e21db8fb4adbc44afb95b2e07e8bde
How does Special Relativity explain the phenomenon of time dilation?,"Special Relativity explains time dilation through the concept of relative motion. When two observers are in relative motion, each perceives the other's clocks as running slower. This effect is quantified by the Lorentz factor, which depends on the relative velocity between the observers.",0cd4599980351308ae84fcf6cfb14dd6
How does the philosophy of monistic idealism differ from material realism?,"Monistic idealism posits that consciousness, not matter, is the fundamental reality, and that both the world of matter and mental phenomena are determined by consciousness. In contrast, material realism assumes that only matter is real, and all else, including consciousness, are secondary phenomena of matter.",a319da94c22b8cd0c892e7211032d392
"What is the central concept of the book ""Quantum Chance""?","The central concept of the book is nonlocality, which refers to the phenomenon where two widely separated objects in space can form a single entity, and actions on one can affect the other instantaneously, without any physical connection between them.",3b2c0239fe49fa975bf082073cb7d04a
How did the concept of redundancy play a crucial role in the development of information theory?,"Redundancy, the extra clues in a message that allow the meaning to be understood even when the message is partially garbled, was crucial in the development of information theory because it helped in understanding how information can be measured and manipulated, and how it must be carried from sender to receiver securely.",ee660b723be02906f4b54e5057dabf98
"What is the role of supersymmetry in particle physics, and how does it relate to dark matter?","Supersymmetry is a theoretical framework in particle physics that proposes a symmetry between fermions (matter particles) and bosons (force particles). It relates to dark matter because one of the predicted particles from supersymmetry, the neutralino, is a leading candidate for dark matter due to its stability and weak interactions with other matter.",7dc0f11a13ab6e1fe2b019ed154d79cc
What was the significance of the Enigma machine in the context of information theory?,"The Enigma machine, a cipher device used by the Germans during World War II, was significant in the context of information theory because its cracking by Alan Turing and his colleagues at Bletchley Park marked a transition from cryptography as an art to a science, paving the way for the formalization of information theory.",ee660b723be02906f4b54e5057dabf98
What role does nonlocality play in quantum mechanics according to the book?,"Nonlocality in quantum mechanics refers to the phenomenon where the state of one quantum object instantly influences its correlated partner, no matter how far apart they are. This challenges the principle of locality, which states that all interactions are mediated by signals through space-time, and is supported by experiments like Aspect's.",a319da94c22b8cd0c892e7211032d392
How does the author describe the relationship between energy and information in the universe?,"The author describes energy as making physical systems do things and information as telling them what to do. The interplay between these two quantities, governed by the laws of thermodynamics, shapes the universe.",7d29a936f0ff1114a40ff8fc0420568c
"What role do neutrinos play in the universe, and what recent discoveries have been made about them?","Neutrinos are nearly massless particles that interact very weakly with other matter, making them difficult to detect. Recent discoveries have shown that neutrinos do have mass and can change flavors, or oscillate, which was previously thought to be impossible. This has implications for understanding the exotic dark matter that makes up a significant portion of the universe's mass.",12106a4acd53251e4e29f9062d7fe9d1
"What is dark energy, and how was its existence discovered?","Dark energy is a mysterious force that seems to be causing the universe to expand at an accelerating rate. Its existence was discovered through observations of distant supernovae, which showed that the expansion of the universe was not slowing down as expected but was instead speeding up.",12106a4acd53251e4e29f9062d7fe9d1
How does tidal friction affect the Earth's rotation?,"Tidal friction slows down the Earth's rotation by dissipating energy, causing the length of the day to increase over time.",50d0e98cd6d39da391bbc6763e5ee1e7
What were the two fundamental hypotheses of Einstein's theory of relativity?,"The two fundamental hypotheses were the principle of relativity, which stated that the future course of optical phenomena could be predicted from the conditions of the experiment relative to the laboratory in which it is carried out, without knowing the velocity of the laboratory in the universe; and the principle of the constancy of the speed of light, which asserted that light is propagated with a specific speed (c) in a fundamental system of reference, regardless of the velocity of the light source.",f675deb55a454dba15b9a5fb47e7d8a7
What is the significance of the Planck length in physics?,"The Planck length is the smallest possible scale in physics, where traditional notions of space and time break down, and quantum gravitational effects become significant. It is the scale at which a more comprehensive theory of quantum gravity is needed.",250200c2919a4d5358285a0ee171d54c
Describe the development and impact of Maxwell's equations on the field of electromagnetism.,"Maxwell's equations are a set of four differential equations that describe the behavior of electric and magnetic fields. They unified previously unrelated observations, experiments, and equations of electricity, magnetism, and optics into a consistent theory. The equations also predicted the existence of electromagnetic waves, which led to the development of radio, television, and other wireless technologies.",015dfec3d42bb4dd0607b2f89cb75fdf
How does the concept of gravitational lensing challenge our understanding of the Universe?,"Gravitational lensing challenges our understanding by revealing the invisible matter in the Universe and providing a new way to observe distant galaxies and quasars. It also forces us to reconsider the nature of space and time, as predicted by general relativity.",661e43f2fc345ba4793979e2e140b733
"What is the cosmological constant problem, and why is it significant?","The cosmological constant problem refers to the discrepancy between the observed value of dark energy (associated with the cosmological constant) and the value predicted by quantum field theory. The predicted value is much larger (10^120 times) than the observed value, which is significant because it challenges our understanding of fundamental physics.",7dc0f11a13ab6e1fe2b019ed154d79cc
What is the concept of the two-creation model in Christianity according to the book?,"The two-creation model in Christianity, according to the book, involves a temporal creation (the present universe) and an eternal new creation. The temporal creation serves as a preparation ground for humans to choose and be equipped for the perfect, eternal new creation.",96e21db8fb4adbc44afb95b2e07e8bde
"What was the significance of Einstein's mass-energy equivalence formula, E=mc^2?","The mass-energy equivalence formula, E=mc^2, was significant because it established a relationship between mass and energy, indicating that a small amount of mass could transform into a large amount of energy. This formula played a crucial role in the development of our understanding of atomic physics and the release of atomic energy.",f675deb55a454dba15b9a5fb47e7d8a7
How did the introduction of the Global Positioning System (GPS) revolutionize navigation?,"The introduction of the GPS revolutionized navigation by providing real-time, highly accurate positioning information, eliminating the need for complex celestial navigation techniques and greatly enhancing the safety and efficiency of travel.",30c7d34938922b1b23c889694b9955a2
How does the study of galaxy clusters contribute to our understanding of dark matter and dark energy?,"Galaxy clusters are the largest objects bound by gravity and contain a high proportion of dark matter. By studying how galaxies and hot gas are distributed within clusters, scientists can map the distribution of dark matter and test theories about dark energy's role in the Universe's expansion.",661e43f2fc345ba4793979e2e140b733
How does the author reconcile the many-worlds theory with idealism?,"The author reconciles the many-worlds theory with idealism by suggesting that the parallel universes of the many-worlds theory are not material but archetypal in content, existing in a transcendent domain of reality. Each observation makes a causal pathway in the fabric of possibilities in this domain, and once the choice is made, all except one of the pathways are excluded from the world of manifestation.",a319da94c22b8cd0c892e7211032d392
How does the Unified Field Theory attempt to reconcile gravity with other fundamental forces?,"The Unified Field Theory, pursued by Einstein, aims to find a single, comprehensive framework that describes both gravity and electromagnetic forces (and potentially other fundamental forces) in a unified manner, suggesting that these forces may have a common underlying basis or origin.",50d0e98cd6d39da391bbc6763e5ee1e7
What is the significance of the Bible's descriptions of the universe in the book?,"The significance of the Bible's descriptions of the universe in the book is that they accurately predict scientific discoveries about the universe's origin, structure, and history, affirming the reliability of Scripture's message about the universe's characteristics.",96e21db8fb4adbc44afb95b2e07e8bde
What role does information play in the understanding of life according to the book?,"According to the book, information plays a central role in the understanding of life as it is the fundamental element that drives the replication and preservation of genetic material. The laws of information theory guide every living creature, from bacteria to humans, in their cellular processes and evolutionary strategies.",ee660b723be02906f4b54e5057dabf98
What is the significance of the El Tatio Geysers in Chile?,"The El Tatio Geysers in Chile are significant because they provide an analogy for understanding the early Universe. The geysers demonstrate how complex patterns and structures can emerge spontaneously from simple, symmetric building blocks, similar to how the Universe evolved from the initial Big Bang state.",08070dadebd8208d9c0604e3d55b3dbb
"What role does the cosmological constant play in Einstein's equations, and why did Einstein consider it his ""biggest blunder""?","The cosmological constant was added by Einstein to his equations to allow for a static universe, which was the prevailing belief at the time. However, after the discovery that the Universe is expanding, Einstein considered the constant unnecessary and referred to it as his ""biggest blunder.""",661e43f2fc345ba4793979e2e140b733
How does entropy relate to the concept of information in the book?,"In the book, entropy is related to information as a measure of unpredictability and disorder in a system. Shannon's entropy, a concept borrowed from thermodynamics, is used to quantify the amount of information in a message, with higher entropy corresponding to higher uncertainty and thus more information.",ee660b723be02906f4b54e5057dabf98
What is the significance of the Treaty of Tordesillas in the context of global exploration?,"The Treaty of Tordesillas, signed in 1494, divided the newly discovered lands outside Europe between Spain and Portugal, establishing spheres of influence and reducing the likelihood of conflicts between the two nations over territorial claims.",30c7d34938922b1b23c889694b9955a2
What is the primary motivation behind the European Age of Exploration?,"The primary motivation behind the European Age of Exploration was the desire to find a direct sea route to the Orient for trading purposes, particularly for spices, which were highly valued in Europe.",30c7d34938922b1b23c889694b9955a2
How does ultrasound imaging utilize the Doppler effect?,"Ultrasound imaging utilizes the Doppler effect to measure blood flow by detecting changes in the frequency of the reflected ultrasound waves caused by moving particles, such as blood cells. This allows for the visualization and quantification of blood flow velocities within the body.",8c17dccdcecf806604208a748c4f906f
"What is quantum teleportation, and how does it work?",Quantum teleportation is the process of transferring the quantum state of a particle to another particle without physical transmission of the original particle. It works by using entangled particles and a classical communication channel to transmit the result of a joint measurement.,3b2c0239fe49fa975bf082073cb7d04a
How does the photoelectric effect contribute to X-ray contrast?,"The photoelectric effect contributes to X-ray contrast by causing the absorption of X-ray photons in matter, which is dependent on the density and composition of the material. This absorption varies between different tissues, creating contrast in the resulting X-ray image.",8c17dccdcecf806604208a748c4f906f
"What is the Standard Model of particle physics, and what does it describe?",The Standard Model of particle physics is a theory that describes all the known fundamental particles and three of the four fundamental forces of nature (excluding gravity). It includes fermions (matter particles) and bosons (force-carrying particles).,7dc0f11a13ab6e1fe2b019ed154d79cc
How did the Hubble Space Telescope correct its initial flaw?,The Hubble Space Telescope corrected its initial flaw by being fitted with corrective equipment during a space shuttle mission in 1993. This included the installation of corrective optics that fixed the misshapen primary mirror.,08070dadebd8208d9c0604e3d55b3dbb
How did the concept of triangulation improve land surveying?,"Triangulation improved land surveying by allowing surveyors to measure distances and angles accurately over long distances, creating a network of triangles that could be used to map large areas with precision.",30c7d34938922b1b23c889694b9955a2
How does the no-cloning theorem impact quantum information theory?,"The no-cloning theorem, which states that it is impossible to create an identical copy of an arbitrary unknown quantum state, has profound implications for quantum information theory. It ensures the security of quantum cryptography and limits the possibilities for quantum computing.",3b2c0239fe49fa975bf082073cb7d04a
How does the history of medical imaging relate to the evolution of digital data processing and computer science?,"The history of medical imaging is closely linked to the evolution of digital data processing and computer science, as medical imaging relies on physics, mathematics, biology, computer science, and engineering. The advent of digital computers for data processing is crucial for image formation in modern modalities.",8c17dccdcecf806604208a748c4f906f
What is the role of the Minkowski spacetime in Special Relativity?,"Minkowski spacetime is a four-dimensional continuum that combines the three dimensions of space with one dimension of time. It provides a geometric framework for understanding the effects of Special Relativity, such as time dilation and length contraction, and is essential for visualizing the relationships between events in different inertial frames.",0cd4599980351308ae84fcf6cfb14dd6
How does the book explain the presence of evil and suffering in the universe?,"The book explains the presence of evil and suffering in the universe as part of a temporary creation designed to prepare humans for a new creation where evil and suffering will be eradicated, and to demonstrate God's love and grace through redemption.",96e21db8fb4adbc44afb95b2e07e8bde
How did the lunar distance method contribute to the solution of the longitude problem?,"The lunar distance method contributed to the solution of the longitude problem by allowing navigators to measure the angular distance between the moon and other celestial bodies, which could be used to calculate longitude based on known tables and observations.",30c7d34938922b1b23c889694b9955a2
What is the significance of the Lorentz transformation in Special Relativity?,The Lorentz transformation is significant in Special Relativity as it provides the mathematical framework for transforming coordinates between different inertial reference frames. It ensures that the speed of light remains constant in all frames and accounts for the effects of time dilation and length contraction.,0cd4599980351308ae84fcf6cfb14dd6
