input,answers,context_id
What is the significance of the FPS service in AWS?,"FPS enables the building of applications that provide an online store or marketplace between customers and third-party vendors, handling payments from traditional sources or internal Amazon Payments accounts.",62935717ba3d54eef7b8ff426b94d29a
What is the main goal of the devops movement as described in the book?,"The main goal of the devops movement is to foster a culture of collaboration, affinity, and tooling at scale, enabling organizations to develop and maintain sustainable work practices.",3c7f2d14b1a259deeb63604651a04697
What is Pure Data (Pd) and what is its primary purpose in the context of this book?,"Pure Data (Pd) is a programming language for digital audio and multimedia processing. In the context of this book, it is used as the core technology for creating musical apps, providing a platform for real-time audio synthesis, processing, and interaction.",2c4f426048af88ff30f4f7a8def2aff4
What are the global attributes in HTML5?,"Global attributes in HTML5 include `accesskey`, `class`, `contenteditable`, `contextmenu`, `dir`, `draggable`, `dropzone`, `hidden`, `id`, `lang`, `spellcheck`, `style`, `tabindex`, `title`, and `translate`.",c84b20f2dc9c88ddafc17b527705a188
"What is the role of categories and tags in organizing a wiki, according to the book?","Categories and tags are used to organize and link related pages in a wiki. They help in grouping pages into different sections so that users can easily find related content. Categories are more structured and predefined, while tags are more flexible and can be added by users.",9596f551be5e415e24d36b48ec543d77
"How does the book interpret the role of algorithms in the ""interface economy""?","The book interprets algorithms as central to the interface economy, where they mediate human-to-human interactions, manage ad hoc logistics, and structure access to platforms through carefully constructed interfaces.",3c14e08bf5d9f84791cd718d647d6d83
How does the book suggest measuring the success of a blog?,"The book suggests measuring the success of a blog using tools such as Google PageRank and Alexa Ranking. PageRank is an algorithm used by Google to rank web pages, while Alexa measures websites based on the traffic they receive.",3171e28c5af0984fbc4ffab32c46684e
How does the book demonstrate the use of a gravity grid in a game environment?,"The book demonstrates the use of a gravity grid by creating a grid of points that behave according to Newton's law of gravity, and it shows how the movement of objects can change the shape of the grid to produce visually interesting effects.",53688b66c83a8080378f09c7a278e159
"What is the central thesis of ""We Are Data""?","The central thesis of ""We Are Data"" is that algorithms assemble and control our datafied selves, shaping our identities and futures through algorithmic interpretations of our data.",e4cffb206209b2e3774124e5cc992b5b
What types of charts and graphs are covered in the book?,"The book covers a wide range of charts and graphs, including bar charts, line charts, pie charts, scatter charts, bubble charts, and radar charts.",775b85e80ceaa0e386ac6549e6d1c221
What is the significance of the Knowledge Base in the context of Nessus plug-ins?,"The Knowledge Base in Nessus plug-ins allows plug-ins to communicate with each other and with the Nessus engine. It is a shared memory space where plug-ins can define and retrieve items, which is useful for sharing information between different plug-ins.",608835cacce8f2da6d1f9e955dbe9a2c
How does EAGLE help in the design of printed circuit boards (PCBs)?,"EAGLE (Easily Applicable Graphical Layout Editor) is a software tool that assists in creating PCB designs by providing features for drawing schematics, laying out boards, and generating fabrication files.",7df211d1929fe30c218928addb3da81e
"What is the main theme of ""Zero to Maker""?","The main theme of ""Zero to Maker"" is the journey of personal transformation from a non-maker to a maker, focusing on the process of learning, creating, and collaborating within the maker community.",f461769e62f57079e31b939b01e78655
"What is the concept of ""algorithmic reading"" as discussed in the book?","Algorithmic reading is a mode of thought and a tool for thinking that anyone can use to interpret cultural artifacts, focusing on the culture machine itself rather than just its cultural outputs.",3c14e08bf5d9f84791cd718d647d6d83
What are some of the challenges and limitations of using VR for training and education?,"Some challenges and limitations of using VR for training and education include the high cost of VR equipment, the potential for simulator sickness, the need for high-performance computing resources, and the requirement for specialized content creation. Additionally, there is a need for further research to understand the long-term effects of VR on learning and cognitive development.",d1331b2bd4e259b4870f1a0e95e2bad0
What are some common examples of blacklists and whitelists in the context of Web applications?,"Common examples of blacklists include the seven words forbidden from being broadcast over U.S. airwaves, while a whitelist example is a vending machine that only accepts certain coins.",7ef5839acfcc562593af3c7d99d53ebd
How does the book critique the concept of 'big data'?,"The book critiques 'big data' by highlighting its reliance on correlation without causation, its tendency to produce incomplete and sometimes misleading insights, and its mythology of offering a higher form of intelligence and knowledge that can generate previously impossible insights.",e4cffb206209b2e3774124e5cc992b5b
How does the `embed` element differ from the `object` element?,"The `embed` element is used for embedding an object into the web page, typically multimedia files that use plug-in technology for playback. The `object` element is a more generic element used for embedding external resources and can also contain `param` elements to pass important information to the object.",c84b20f2dc9c88ddafc17b527705a188
How does Google Analytics handle data collection and processing?,"Google Analytics uses page tags (JavaScript code) to collect data, which is then processed at regular intervals (approximately every 3 hours) and stored in a database. Reports are created in real-time by comparing dimensions to metrics.",81f24ede7be57980985e6348957794e2
What are the key characteristics of a sine wave in wireless communications?,"A sine wave has characteristics such as amplitude, frequency, wavelength, and phase, which are manipulated to convey different meanings or information in wireless communications.",25c1cf0fff3e80987d5d7e87df37c2f3
"What is the importance of continuous integration (CI) in DevOps as per ""The DevOps Handbook""?","Continuous integration is important in DevOps because it ensures that code changes are frequently merged into a shared repository, tested, and validated, reducing the risk of integration issues and enabling faster delivery of features.",47f2d1822dbd4242642a16a294e56791
What is libpd and how does it differ from Pure Data?,"libpd is a thin wrapper on top of Pure Data that transforms Pd into an embeddable audio library. Unlike Pd, which is typically used as a standalone application, libpd allows developers to integrate Pd's capabilities into other applications, particularly mobile apps, by providing language bindings and platform-specific glue code.",2c4f426048af88ff30f4f7a8def2aff4
How does the book describe the lifecycle of a wiki user?,"The book describes the lifecycle of a wiki user as progressing from being a reader, to an editor who makes improvements, to a contributor who adds new content, and finally to a manager or champion who oversees the wiki or starts new wikis.",9596f551be5e415e24d36b48ec543d77
What challenges did the author highlight in the transfer of technology from one community to another?,The author highlighted that the transfer of technology from one community to another faces challenges such as matching the resources and skills available in the recipient community to those of the donor. Successful transfer requires that the recipient community has the necessary technical competence and willingness to learn and adapt the technology to local needs.,0b885c0f50723a9559d31b5a89d361b2
What are the benefits of using a reflow oven in SMT assembly?,"A reflow oven is used to heat SMT assemblies to melt solder paste, which permanently joins the components to the PCB. This method ensures precise control over the soldering process, leading to higher quality and reliability of the soldered connections.",7df211d1929fe30c218928addb3da81e
What role did YouTube and Let's Play videos play in the popularity and spread of Minecraft?,YouTube and Let's Play videos were instrumental in spreading Minecraft's popularity by allowing players to share their creative builds and gameplay experiences. This user-generated content created a vibrant community and attracted new players to the game.,737c736be7be19e9af3619192070706a
What is the significance of the `execScript` function in both VBScript and JScript?,"The `execScript` function allows the execution of code in a specified scripting language, enabling the combination of VBScript and JScript within the same context. This can be used for obfuscation by mixing different scripting languages and their respective encoding techniques.",7ef5839acfcc562593af3c7d99d53ebd
How can you password-protect a user account in Windows 10?,"To password-protect a user account in Windows 10, you can go to the Accounts settings, select the user account, and then choose to create a password, providing a new password and a password hint.",9a5d95792fe412469de0b8393b3fb9b4
What is the Action Center in Windows 10 and what functions does it serve?,"The Action Center in Windows 10 is a feature that provides quick access to settings and features, as well as displaying system notifications. It replaces the Charms bar from Windows 8.",9a5d95792fe412469de0b8393b3fb9b4
How does the book address the issue of performing the same calculation over and over in SQL queries?,"The book suggests using a derived table to store the result of a complex calculation, allowing it to be referenced multiple times in the outer query without repeating the calculation, thus improving readability and maintainability.",7a31c4cee86943a2eb9b02f8ade6db6d
How did Gutenberg's invention of the printing press revolutionize the publication of books?,"Gutenberg's invention of the printing press revolutionized the publication of books by allowing for mass production. More books were published in the first fifty years following Gutenberg than had been produced in the previous thousand years, significantly increasing the availability and dissemination of written material.",0b885c0f50723a9559d31b5a89d361b2
How can RSS feeds be used in conjunction with social media accounts?,RSS feeds can be integrated with social media accounts like Twitter and Facebook to automatically publish new blog posts and content to these platforms.,91def87a41b49240214b80a4560ac4c2
How does the book handle data retrieval and processing for visualization?,"The book discusses methods for retrieving data from various sources, including direct input, AJAX calls, and APIs, and covers data processing techniques to prepare data for visualization.",775b85e80ceaa0e386ac6549e6d1c221
What are the different operational modes of a WAP?,"The operational modes of a WAP include root mode (infrastructure mode), bridge mode, and repeater mode, each serving different networking purposes.",25c1cf0fff3e80987d5d7e87df37c2f3
How does VBScript differ from JavaScript in terms of syntax and functionality?,"VBScript differs from JavaScript in that it uses different syntax for comments (`REM` and single quotes) and allows functions to be called without parentheses. It also supports encoded scripts within script tags, which can be used for obfuscation.",7ef5839acfcc562593af3c7d99d53ebd
What is the primary purpose of Google Analytics?,"The primary purpose of Google Analytics is to quantitatively measure what happens on a website, helping everyone become a web analyst and track and measure website performance and online marketing initiatives.",81f24ede7be57980985e6348957794e2
What are the four fundamental patterns of wiki pages mentioned in the book?,"The four fundamental patterns of wiki pages are document mode, thread mode, structured mode, and structured wikis. Document mode pages are formatted with headings and content like a book or website, thread mode pages have comments added in a conversational thread, and structured mode pages have predefined templates or forms.",9596f551be5e415e24d36b48ec543d77
What are the challenges in securing wireless communications?,"Challenges include the invisibility of wireless signals, their almost boundless propagation, and the ease with which they can be monitored, requiring robust security measures to protect data integrity and confidentiality.",25c1cf0fff3e80987d5d7e87df37c2f3
How does the `UIActivityViewController` simplify social media integration in iOS apps?,"The `UIActivityViewController` simplifies social media integration by providing a unified interface for sharing content across various services like Facebook, Twitter, and email, without requiring developers to implement each service's API separately.",2c22f0411a56fe5ed3d163bd55f1cba2
What are some techniques for executing JavaScript with little or no user interaction?,"Techniques include using event handlers like `onload`, `onerror`, and `onfocus`, as well as leveraging attributes like `autofocus` and `location.hash` to trigger JavaScript execution without direct user interaction.",7ef5839acfcc562593af3c7d99d53ebd
How does the book address the challenges of accessing tools and resources for makers?,"The book addresses the challenges of accessing tools and resources by discussing various platforms and communities such as hackerspaces, makerspaces, and fab labs, as well as the importance of sharing and collaborative consumption.",f461769e62f57079e31b939b01e78655
"What is the primary purpose of the book ""Web Application Obfuscation""?",The primary purpose of the book is to highlight weaknesses in Web application security measures and focus on obfuscation techniques that can be used to hide malicious Web attacks.,7ef5839acfcc562593af3c7d99d53ebd
How does the book recommend building an analytics culture within an organization?,"The book recommends building an analytics culture through education, leadership support, and embedding analytics into everyday decision-making processes.",e4f470aa51677533a8101dcc030226b5
"How does David Lang utilize the ""Just-in-Time"" learning model?","David Lang utilizes the ""Just-in-Time"" learning model by learning skills as needed, focusing on practical application and problem-solving, rather than following a predetermined curriculum.",f461769e62f57079e31b939b01e78655
What programming languages does the book assume readers are familiar with?,The book assumes readers are familiar with programming languages such as C and Perl.,608835cacce8f2da6d1f9e955dbe9a2c
What is the approach recommended by the book for converting subqueries to JOINs in SQL?,"The book recommends marking all columns with the table name they come from, moving all FROM statements together to form a single FROM clause, and substituting AND for WHERE after the first occurrence of WHERE, to convert subqueries to JOINs.",7a31c4cee86943a2eb9b02f8ade6db6d
What is the purpose of the `data` and `datalist` elements?,"The `data` element provides a machine-readable equivalent for its content, while the `datalist` element creates a drop-down menu of pre-defined suggestions for an `input` control, providing an ""auto-complete"" function as the user types.",c84b20f2dc9c88ddafc17b527705a188
"What are the challenges of programming for the Arduino Due's USB Host feature, as mentioned in the book?","The challenges include the experimental nature of the USB Host feature on the Arduino Due, the need for a Micro USB OTG Host Cable to connect USB devices, and the complexity of the Host Shield Libraries, which provide a low-level interface to the USB bus.",1ee31b60b19c4c031badacee94f0419a
What are some common challenges faced when manually routing a PCB in EAGLE?,"Common challenges in manually routing a PCB include ensuring that all connections are made without violating design rules, optimizing track lengths and angles for performance, and managing space constraints to fit all components and tracks efficiently.",7df211d1929fe30c218928addb3da81e
What is the importance of design in business blogging according to the book?,"The book emphasizes that design is crucial in business blogging as it facilitates the strategic goals of the blog. It suggests that WordPress provides almost unlimited control over the look and feel of the blog, allowing for a design that is unique and fits the blog's purpose perfectly.",3171e28c5af0984fbc4ffab32c46684e
What are some of the deployment options for RjDj scenes discussed in the book?,"Some of the deployment options for RjDj scenes discussed in the book include installing scenes directly on an Android device by copying them to the SD card, using rjzserver for local installations on iOS devices, and uploading scenes to the RjDj website for distribution to iOS users.",2c4f426048af88ff30f4f7a8def2aff4
What is the significance of the `main` element in HTML5?,"The `main` element represents the main content area of the `body` of a document. There may only be one `main` element in a document, and it may not be the child of an `article`, `aside`, `footer`, `header`, or `nav` elements.",c84b20f2dc9c88ddafc17b527705a188
Who is the intended audience for this book?,"The intended audience includes penetration testers, security researchers, incident responders, quality assurance testers, application developers, and application architects, as well as information security and software development professionals.",7ef5839acfcc562593af3c7d99d53ebd
Can you name some of the network security tools discussed in the book?,"Some of the network security tools discussed in the book include Nessus, Ettercap, Hydra, Metasploit, Nessus, Nikto, and Nmap.",608835cacce8f2da6d1f9e955dbe9a2c
Who is the intended audience for this book?,The book is intended for anyone interested in extending existing open source network assessment tools and writing their own assessment tools. It is particularly useful for network security assessment professionals or hobbyists.,608835cacce8f2da6d1f9e955dbe9a2c
How has VR been used in the treatment of PTSD?,"VR has been used in the treatment of PTSD by creating immersive environments that replicate traumatic events, allowing patients to confront and process their memories in a controlled setting. This method, known as virtual reality exposure therapy, helps patients to reduce the power of traumatic memories and manage symptoms of PTSD.",d1331b2bd4e259b4870f1a0e95e2bad0
"How does ""The DevOps Handbook"" suggest integrating Operations into the daily work of Development?","The book suggests integrating Operations by creating self-service capabilities, embedding Ops engineers into service teams, and assigning Ops liaisons to service teams to ensure that Operations is involved in the planning and execution of development work.",47f2d1822dbd4242642a16a294e56791
What are the ethical considerations surrounding the use of VR in therapy?,"Ethical considerations surrounding the use of VR in therapy include the potential for causing distress or harm to patients, the need for informed consent regarding the intensity of the virtual experiences, and the responsibility of therapists to ensure the safety and well-being of patients during therapy sessions.",d1331b2bd4e259b4870f1a0e95e2bad0
What is the CIPHER model introduced in the book and what does it stand for?,"The CIPHER model is a framework for identifying emerging trends by uncovering hidden patterns. It stands for Contradictions, Inflections, Practices, Hacks, Extremes, and Rarities.",987232d753ba0b115444e4fa7d114adf
"What is the central theme of Ed Finn's book ""What Algorithms Want""?","The central theme of the book is to explore how algorithms, as culture machines, intersect with computational space, cultural systems, and human cognition, and how they are transforming our world today.",3c14e08bf5d9f84791cd718d647d6d83
How does the book define 'measurable types'?,"The book defines 'measurable types' as data templates that construct new, transcoded interpretations of the world, used to assign users an identity based on algorithmic fit with existing datafied models.",e4cffb206209b2e3774124e5cc992b5b
What advice does the book give for attracting users to a wiki?,"The book advises having a clear elevator pitch to explain the value of the wiki, stating the goals and project clearly, and not trying to do too much on one page. It also suggests encouraging the use of WYSIWYG editors for new users and allowing them to attempt using markup languages when they are comfortable.",9596f551be5e415e24d36b48ec543d77
What are the limitations of Google Analytics regarding historical data?,"Once Google Analytics has processed and stored data in the database, it cannot be changed. Any mistakes made during setup or configuration can permanently affect the quality of the data, and configuration changes only affect future data, not past data.",81f24ede7be57980985e6348957794e2
What are the two main parts of the book?,"The book is divided into two parts. Part I covers commonly used open source security tools and shows how to leverage them to solve network security problems. Part II describes approaches to writing custom Linux kernel modules, web application vulnerability identification and exploitation tools, packet sniffers, and packet injectors.",608835cacce8f2da6d1f9e955dbe9a2c
What is the significance of the doctype declaration in HTML?,"The doctype declaration is significant because it links the DTD (Document Type Definition) with the HTML document, allowing the parser or validator to determine how to deal with the document or assess its validity.",7ef5839acfcc562593af3c7d99d53ebd
What are the key strategic goals for business blogging as outlined in the book?,"The key strategic goals for business blogging include increasing sales, adding value to products and services, opening a dialog with customers, raising awareness of the company and its offerings, demonstrating expertise, providing customer service, improving public relations, driving traffic to other websites, and adding personality to the corporate image.",3171e28c5af0984fbc4ffab32c46684e
What is the central role of technology in human affairs according to James Clerk Maxwell's statement?,"According to James Clerk Maxwell, the central role of technology in human affairs is symbolized by instruments like a foot rule, a set of weights, and a clock, which are products of technology and essential for the functioning of civilized life.",0b885c0f50723a9559d31b5a89d361b2
How does Objective-C differ from Java and C# in terms of method signatures?,"Objective-C method signatures tend to be very long and explicit, reflecting its roots in Smalltalk. Unlike Java and C#, Objective-C uses a syntax where parameters are listed inline with the method name, enhancing code readability.",2c22f0411a56fe5ed3d163bd55f1cba2
What is the purpose of the HUD (Heads-Up Display) in the book's case study?,"The purpose of the HUD in the book's case study is to display important information such as scores, health statistics, and other game-related data in a visually accessible manner.",53688b66c83a8080378f09c7a278e159
How does the Internet of Things (IoT) impact the use of sensors?,"The IoT enhances the use of sensors by enabling the connection of more devices to the Internet, thereby increasing the potential for applications that improve the way people live, learn, work, and entertain themselves through pervasive connectivity and data processing.",547951ad663b0f33d55b833e85aaf6c2
How did the invention of the fly shuttle by John Kay impact the textile industry?,"The invention of the fly shuttle by John Kay significantly impacted the textile industry by speeding up the weaving process and allowing for wider fabrics to be produced. This increased productivity put pressure on spinners to produce thread more quickly, leading to further innovations in textile manufacturing.",0b885c0f50723a9559d31b5a89d361b2
What are some common uses of the Text widget in WordPress?,"Common uses include adding an e-mail newsletter subscription form, displaying business hours, and embedding social media updates.",91def87a41b49240214b80a4560ac4c2
How do automatic updates work in Windows 10 and why are they important?,Automatic updates in Windows 10 ensure that the system receives the latest security patches and feature enhancements without user intervention. They are important for maintaining system security and stability.,9a5d95792fe412469de0b8393b3fb9b4
"How do conditional comments in Internet Explorer work, and why are they useful for obfuscation?","Conditional comments in Internet Explorer allow developers to target specific versions of Internet Explorer and introduce conditional syntax. They are useful for obfuscation because they can be used to hide code from certain browsers, making it harder to detect and decode the actual functionality.",7ef5839acfcc562593af3c7d99d53ebd
How does the book recommend dealing with the issue of team silos?,"The book recommends breaking down team silos by encouraging open communication, shared goals, and cross-functional collaboration to ensure that information and responsibilities are not hoarded but shared across the organization.",3c7f2d14b1a259deeb63604651a04697
