input,answers,context_id
What is Tablet Mode in Windows 10 and how does it affect the user interface?,"Tablet Mode in Windows 10 optimizes the user interface for touch-based devices by switching the device to a full-screen Start menu and causing apps to open in full-screen mode, with no windowed app experience.",9a5d95792fe412469de0b8393b3fb9b4
What are some popular text editors recommended for editing WordPress code?,"Popular text editors include Notepad (Windows), Notepad++ (Windows), and TextMate (Mac).",91def87a41b49240214b80a4560ac4c2
How does the book recommend promoting a business blog?,"The book recommends promoting a business blog through various techniques such as search engine optimization (SEO), taking advantage of social networking and social bookmarking, syndication, and submitting the blog to various indices like Technorati.",3171e28c5af0984fbc4ffab32c46684e
What are the key features of hosted wikis that the book discusses?,"The key features of hosted wikis discussed in the book include ease of setup, user invitations and limits, storage space, openness to all users or restricted access, page protection, cost, customization capabilities, number of wikis, and data export capabilities.",9596f551be5e415e24d36b48ec543d77
Does the book include interactive visualizations?,"Yes, the book includes examples and techniques for creating interactive visualizations that allow users to explore data dynamically.",775b85e80ceaa0e386ac6549e6d1c221
"How does ""The DevOps Handbook"" suggest managing technical debt?","The book suggests managing technical debt by dedicating a portion of development time to refactoring, investing in automation, and improving architecture and non-functional requirements.",47f2d1822dbd4242642a16a294e56791
