input,answers,context_id
"What are the Three Ways described in ""The DevOps Handbook""?","The Three Ways are principles that underpin DevOps practices: 1) Flow, which accelerates the delivery of work from Development to Operations; 2) Feedback, which creates ever safer systems of work; and 3) Continual Learning and Experimentation, which fosters a high-trust culture and a scientific approach to risk-taking.",47f2d1822dbd4242642a16a294e56791
"How do sensor network topologies vary, and what are their applications?",Sensor network topologies can vary from point-to-point to mesh configurations. Applications range from personal area networks (PANs) for personal health monitoring to wide area networks (WANs) for environmental monitoring over large geographical areas.,547951ad663b0f33d55b833e85aaf6c2
What does the book say about the impact of algorithms on labor and value?,"The book discusses how algorithms are restructuring labor and value by blurring the boundaries between work and play, and by creating new forms of arbitrage that extract attention and revenue from spaces of ""play.""",3c14e08bf5d9f84791cd718d647d6d83
What is the significance of permalinks in WordPress?,Permalinks are permanent links to individual blog posts and are crucial for SEO as they help search engines index content effectively.,91def87a41b49240214b80a4560ac4c2
How does the book address the complexity of SOAP interfaces in AWS?,"The book focuses on REST and Query interfaces, avoiding SOAP due to its added complexity and overhead, which can spoil the simplicity and transparency that web services should offer.",62935717ba3d54eef7b8ff426b94d29a
What are the main prerequisites for readers to have before diving into this book?,"The main prerequisites for readers include some working knowledge of Android or iOS programming, a working development environment, and familiarity with Git and basic Unix command line operations.",2c4f426048af88ff30f4f7a8def2aff4
How does WPA2 improve upon the security features of WPA?,"WPA2 is based on the ratified IEEE 802.11i standard, providing stronger security features compared to WPA, which was based on draft versions of the standard.",25c1cf0fff3e80987d5d7e87df37c2f3
How does WordPress serve as a content management system (CMS)?,"WordPress allows users to easily publish different types of content using one installation, including e-commerce, photo galleries, discussion forums, and more, making it a versatile CMS.",91def87a41b49240214b80a4560ac4c2
What is the primary role of regulatory organizations in the wireless industry?,Regulatory organizations manage the allocation and use of the radio spectrum to prevent interference and ensure sensible use of this shared resource.,25c1cf0fff3e80987d5d7e87df37c2f3
How does VR training compare to traditional training methods in terms of effectiveness?,"VR training has been shown to be more effective than traditional training methods, such as video instruction, in certain scenarios. For example, in a study where participants learned tai chi moves, those who used VR showed a 25% greater accuracy than those who watched a video.",d1331b2bd4e259b4870f1a0e95e2bad0
What is the purpose of the `dialog` element?,"The `dialog` element represents a floating dialog box, such as log-in windows, UI hints, lightboxes, and other pop-up or modal content that requires user interaction.",c84b20f2dc9c88ddafc17b527705a188
What are the four parts into which the book is divided?,"The book is divided into four parts: Understanding the Fundamentals, Getting Started, Building Your Capability, and Establishing an Analytics Culture.",e4f470aa51677533a8101dcc030226b5
"What is the significance of using a VIEW in SQL, as mentioned in the book?","A VIEW in SQL allows you to name a query, treating it as a virtual table. This can simplify complex queries, improve readability, and make queries easier to maintain by encapsulating the logic within the VIEW.",7a31c4cee86943a2eb9b02f8ade6db6d
What are the basic requirements for installing WordPress on a web server?,"The basic requirements include registering a domain name, obtaining a web host, and setting up a MySQL database.",91def87a41b49240214b80a4560ac4c2
"What was Markus Persson's initial reaction to the success of Minecraft, and how did it impact his personal life?","Markus Persson was initially surprised and overwhelmed by the success of Minecraft. The financial windfall allowed him to provide for his family, including taking them on a private jet trip to Paris, and he became a celebrity in the gaming community.",737c736be7be19e9af3619192070706a
"What role does content play in the success of a business blog, as discussed in the book?","The book states that content is king in the success of a business blog. It highlights the importance of creating engaging and relevant content, including copywriting techniques, managing categories and tags, and ensuring that the content is regularly updated and of high quality.",3171e28c5af0984fbc4ffab32c46684e
How does the book handle the integration of sounds into the game environment?,"The book handles the integration of sounds by introducing the Sound class, which uses the Android SoundPool class to play and manage sounds, and it shows how to add sound effects to game objects.",53688b66c83a8080378f09c7a278e159
How does the book introduce the concept of lighting in OpenGL ES 2.0?,"The book introduces the concept of lighting by discussing ambient, diffuse, and specular lighting components and how they are calculated and applied in shaders.",53688b66c83a8080378f09c7a278e159
How does the book address the future developments in Web application attacks?,"The book discusses the current state of security on the Web and the technologies that surround it, including the future Web being enabled with technologies such as CSS3, HTML5, and plug-in security via Flash and Java. It examines the positive and negative security consequences of these technologies and how they may affect us in the near future.",7ef5839acfcc562593af3c7d99d53ebd
What is the role of goals in Google Analytics?,"Goals in Google Analytics help measure conversions, which are specific actions that visitors take on a website that align with business objectives, such as completing a transaction, filling out a form, or subscribing to a newsletter.",81f24ede7be57980985e6348957794e2
What are custom variables in Google Analytics and what are they used for?,"Custom variables are a feature in Google Analytics that allow users to add more information to their data. They are used for segmenting members from nonmembers, tracking campaigns, categorizing content, and more, providing a flexible way to add more information to Google Analytics data.",81f24ede7be57980985e6348957794e2
How can the aesthetics of a PCB be improved during the design process?,"Improving the aesthetics of a PCB can be achieved by carefully planning component placement, using consistent track widths and styles, adding informative labels and silk screening, and ensuring a clean and professional layout.",7df211d1929fe30c218928addb3da81e
"What role did the Society for the Encouragement of Arts, Commerce, and Manufactures play in the Industrial Revolution?","The Society for the Encouragement of Arts, Commerce, and Manufactures played a role in the Industrial Revolution by providing formal and institutional recognition of the advancements in technology, industry, and commerce. It contributed to the promotion and development of these fields, fostering innovation and improvement.",0b885c0f50723a9559d31b5a89d361b2
"What is the primary goal of the book ""Beginning Android 3D Game Development""?",The primary goal of the book is to serve as a quick-start guide to developing 3D games for the Android platform using Java and OpenGL ES 2.0.,53688b66c83a8080378f09c7a278e159
"What are the benefits of using WordPress for business blogging, as mentioned in the book?","The book mentions that WordPress is a powerful blogging platform that allows for good design, maximizing usability, promoting the blog, analyzing statistics, managing content, monetizing the blog, and measuring success.",3171e28c5af0984fbc4ffab32c46684e
What is the significance of creating a generative culture as described in the book?,"Creating a generative culture is significant because it fosters a high-trust environment where learning and experimentation are encouraged, leading to continuous improvement and innovation.",47f2d1822dbd4242642a16a294e56791
What is the role of the Physics class in the book's example projects?,"The Physics class is responsible for updating the object's position and rotation based on linear and rotational forces applied to the object, and it also handles collision detection and response.",53688b66c83a8080378f09c7a278e159
What are some of the HTML5 APIs discussed in the book?,"Some of the HTML5 APIs discussed include the Media API, TextTrack API, Session History API, Offline Web Applications API, Editing API, Drag and Drop API, Canvas API, Web Storage API, Geolocation API, Web Workers API, Web Sockets API, and File API.",c84b20f2dc9c88ddafc17b527705a188
How did Minecraft's open-ended gameplay and building mechanics contribute to its educational potential?,"Minecraft's open-ended gameplay and building mechanics allowed educators to create immersive learning environments where students could apply math, science, and creative thinking skills in a hands-on way, making education more engaging and interactive.",737c736be7be19e9af3619192070706a
How did the indie gaming scene in Sweden contribute to the development of Minecraft?,"The indie gaming scene in Sweden, characterized by small, independent developers focused on creative and innovative games, provided a supportive environment for Markus Persson to experiment and develop Minecraft without the constraints of mainstream gaming industry pressures.",737c736be7be19e9af3619192070706a
What is the main philosophy behind the book's approach to data visualization?,"The main philosophy is to ensure that visualizations are meaningful and practical, focusing on simplicity and clarity to help users understand data intuitively.",775b85e80ceaa0e386ac6549e6d1c221
How does the `UITableView` manage memory efficiently?,"The `UITableView` manages memory efficiently by reusing cells. Instead of creating new cells each time the user scrolls, the table view reuses existing cells, changing the data they display, which reduces memory usage and improves performance.",2c22f0411a56fe5ed3d163bd55f1cba2
What is the significance of data governance in workforce analytics?,"Data governance ensures data quality, consistency, and security, which are crucial for reliable and accurate analytics.",e4f470aa51677533a8101dcc030226b5
What does the concept of 'algorithmic governmentality' entail according to the book?,"'Algorithmic governmentality' involves the use of algorithms to govern and control populations by ignoring embodied individuals and focusing solely on a 'statistical body' or 'data body,' which is a constantly evolving network of localizations in actuarial tables.",e4cffb206209b2e3774124e5cc992b5b
"What is the main purpose of the book ""Programming Arduino Next Steps: Going Further with Sketches"" by Simon Monk?","The main purpose of the book is to guide readers through advanced aspects of Arduino programming, including memory management, multitasking, packaging code in libraries, using hardware and timer interrupts, maximizing performance, minimizing power consumption, interfacing with different types of serial buses, USB programming, network programming, and digital signal processing.",1ee31b60b19c4c031badacee94f0419a
What is the significance of the Netflix Prize in the context of algorithmic culture?,"The Netflix Prize highlighted the limitations of purely statistical approaches to understanding user preferences in entertainment, leading Netflix to develop more nuanced, ambiguity-laden analytical environments that consider content as well as consumers.",3c14e08bf5d9f84791cd718d647d6d83
How does the Domain Name System (DNS) facilitate internet communications?,"DNS maps numerical IP addresses to human-friendly domain names, allowing users to access websites using memorable names instead of numerical addresses.",25c1cf0fff3e80987d5d7e87df37c2f3
How can a sandbox environment be beneficial for WordPress development?,"A sandbox environment allows developers to test and develop themes and plugins without affecting the live website, ensuring stability and security.",91def87a41b49240214b80a4560ac4c2
How can scripts and user-language programs (ULPs) in EAGLE enhance the PCB design process?,"Scripts and ULPs in EAGLE can automate repetitive tasks, perform complex operations, and streamline the design process, saving time and reducing the likelihood of human error.",7df211d1929fe30c218928addb3da81e
What is the main focus of Chapter 5 in the book?,"Chapter 5 focuses on writing modules for the Metasploit Framework, which is a freely available framework for writing and testing network security exploits.",608835cacce8f2da6d1f9e955dbe9a2c
How does the book define technical debt?,Technical debt is defined in the book as the accumulation of shortcuts and poor decisions made during software development that can slow down future development and increase the risk of defects.,47f2d1822dbd4242642a16a294e56791
How does the `canvas` element differ from the `img` element?,"The `canvas` element represents a two-dimensional area that can be used for rendering dynamic bitmap graphics, such as graphs, games, drawing programs, and animations, using scripting (usually JavaScript). In contrast, the `img` element embeds a static image file in the web page.",c84b20f2dc9c88ddafc17b527705a188
What is the role of technology in workforce analytics according to the book?,"Technology plays a crucial role in data collection, storage, analysis, and visualization, enabling more efficient and effective workforce analytics.",e4f470aa51677533a8101dcc030226b5
How does the book describe the relationship between data and privacy?,"The book describes the relationship between data and privacy as muddled, with dataveillance observing, saving, pattern analyzing, and using our own data to profile us, often without our direct knowledge or consent.",e4cffb206209b2e3774124e5cc992b5b
"How does Ed Finn define the term ""algorithm""?","Finn defines the algorithm as a culture machine that spans the gap between computational and material reality, constantly negotiating the tensions between computation and material reality.",3c14e08bf5d9f84791cd718d647d6d83
What are the key steps in the launch sequence for initializing a libpd-based app?,"The key steps in the launch sequence for initializing a libpd-based app are:
1. Initialize the audio components.
2. Create a dispatcher and register it with `PdBase`.
3. Add listeners, if any.
4. Load your patch or patches.
5. Start the audio components.",2c4f426048af88ff30f4f7a8def2aff4
What is a wiki and how is it defined in the context of this book?,"A wiki is defined as a collection of web pages that anyone can edit. It is a style of website invented by Ward Cunningham, where the content is in a shared space and is easy to create and connect, allowing for collective ownership.",9596f551be5e415e24d36b48ec543d77
What is the significance of the 'Time offset' attribute in AWS service clients?,"'Time offset' compensates for differences between a system's clock and AWS's time, ensuring that request signatures are valid, which is crucial for the correct functioning of authenticated requests.",62935717ba3d54eef7b8ff426b94d29a
"How did the concept of Minecraft originate, and what games influenced its development?","The concept of Minecraft originated from Markus Persson's interest in games like Dwarf Fortress, RollerCoaster Tycoon, and Dungeon Keeper. These games influenced the open-ended gameplay and building mechanics that became central to Minecraft.",737c736be7be19e9af3619192070706a
"Who are the two organizations maintaining HTML specifications, and what are their differences?","The two organizations are the World Wide Web Consortium (W3C) and the Web Hypertext Application Technology Working Group (WHATWG). The W3C maintains a ""snapshot"" (numbered) version of HTML5, while the WHATWG maintains a ""living"" (unnumbered) HTML specification.",c84b20f2dc9c88ddafc17b527705a188
What is the role of a project sponsor in workforce analytics projects?,"A project sponsor is responsible for approving the project, providing resources, advocating for the project, and working with stakeholders to ensure that actions are implemented.",e4f470aa51677533a8101dcc030226b5
"What is the primary purpose of the book ""Network Security Tools""?",The primary purpose of the book is to teach readers how to tweak existing and powerful open source assessment tools and how to write their own tools to protect their networks and data from sophisticated attackers.,608835cacce8f2da6d1f9e955dbe9a2c
"What is the role of JavaScript variables in obfuscation, and how can they be manipulated?","JavaScript variables play a crucial role in obfuscation by allowing the manipulation of code through various encoding techniques, alternative syntax, and the use of Unicode characters. This can make the code harder to read and understand, thereby obfuscating its true functionality.",7ef5839acfcc562593af3c7d99d53ebd
What is the significance of the 'right to be forgotten' in the context of the book?,"The 'right to be forgotten' is significant as it grants individuals the ability to request the removal of certain search results that are ""inadequate, irrelevant or no longer relevant,"" challenging the default assumption of public access to personal details.",e4cffb206209b2e3774124e5cc992b5b
How can you troubleshoot startup problems in Windows 10?,"Troubleshooting startup problems in Windows 10 can involve using advanced startup options, system restore, automatic repair mode, safe mode, and checking hardware connections.",9a5d95792fe412469de0b8393b3fb9b4
How does the book suggest handling conditional INSERT statements in SQL?,"The book suggests using the INSERT... SELECT statement to insert a single row only if the room is free, by incorporating a WHERE clause with a NOT EXISTS condition to check for existing bookings.",7a31c4cee86943a2eb9b02f8ade6db6d
What are the potential psychological effects of prolonged VR use?,"The potential psychological effects of prolonged VR use are not fully understood but may include reality blurring, where users confuse virtual experiences with real-life events, and increased susceptibility to the psychological impact of virtual experiences, such as heightened empathy or distress.",d1331b2bd4e259b4870f1a0e95e2bad0
What are the key features of the Arduino Due board mentioned in the book?,"The Arduino Due features include a 84 MHz processor, 512k of flash memory, 96KB of SRAM, two analog outputs, four serial ports, two USB ports, USB host and OTG interfaces, and USB keyboard and mouse emulation capabilities.",1ee31b60b19c4c031badacee94f0419a
What are the three guidelines for selecting important inventions according to the author?,"The three guidelines for selecting important inventions are: 1) how important was a particular invention or series of inventions, 2) to what extent did it stimulate other inventions or innovations, and 3) its close association with science.",0b885c0f50723a9559d31b5a89d361b2
How does the book suggest handling the misconception that devops is only about tools?,"The book suggests that while tools are important, they are not the sole focus of devops. Effective tool usage is necessary but not sufficient; cultural and interpersonal aspects are equally crucial for a successful devops transformation.",3c7f2d14b1a259deeb63604651a04697
What are the benefits of using a Microsoft account in Windows 10?,"Using a Microsoft account in Windows 10 provides access to Microsoft services like Office 365, Windows Phone accounts, and OneDrive, allows syncing settings across multiple devices, and enables downloading apps from the Windows Store.",9a5d95792fe412469de0b8393b3fb9b4
What is the significance of running an Electrical Rule Check (ERC) in EAGLE?,"Running an ERC in EAGLE checks for any electrical issues in the schematic design, such as unconnected pins or nets, ensuring that the design is electrically sound before proceeding to the PCB layout.",7df211d1929fe30c218928addb3da81e
What are the key components of the Android Software Development Kit (SDK)?,"The key components of the Android SDK are the Eclipse IDE, Android SDK Manager, Android Virtual Device Manager, and the actual Android device emulator.",53688b66c83a8080378f09c7a278e159
How does the book suggest managing and protecting a wiki?,"The book suggests that managing a wiki involves tasks such as wiki maintenance, pruning, training, and making changes. Protecting a wiki includes evaluating threats, running a change patrol, controlling editing access, and preparing for disaster recovery.",9596f551be5e415e24d36b48ec543d77
What are the different types of user accounts available in Windows 10?,"Windows 10 offers several types of user accounts including the built-in Administrator account, user accounts with administrative privileges, standard accounts, the Guest account, and Microsoft accounts.",9a5d95792fe412469de0b8393b3fb9b4
"What is the significance of the ""unusual suspects"" in the book?","The ""unusual suspects"" are individuals or organizations working on the fringes of science, technology, and society, often pioneering new ideas and technologies that can lead to significant future trends.",987232d753ba0b115444e4fa7d114adf
What is the difference between the `meter` and `progress` elements?,"The `meter` element represents a fractional value or a scalar measurement within a known range (a gauge), while the `progress` element represents the completion progress of a task.",c84b20f2dc9c88ddafc17b527705a188
What are some common image file formats used in web design?,"Common image file formats include JPG, GIF, PNG (raster), and AI, EPS, CDR (vector).",91def87a41b49240214b80a4560ac4c2
How does a wireless access point (WAP) function in a network?,"A WAP provides a means for wireless nodes to communicate with other wireless nodes or to communicate with a wired network, acting as a gateway for wireless stations to access network resources.",25c1cf0fff3e80987d5d7e87df37c2f3
How does Webb define a trend in the context of technology and society?,"Webb defines a trend as a new manifestation of sustained change within an industry, the public sector, or society, or in the way that we behave toward one another, often driven by a basic human need and new enabling technology.",987232d753ba0b115444e4fa7d114adf
How does the IEEE develop and approve new standards?,"The IEEE develops standards through a process that includes submitting a Project Authorization Request (PAR), forming a working group, drafting the standard, balloting, approval by the IEEE-SA Standards Board, and eventual publication.",25c1cf0fff3e80987d5d7e87df37c2f3
"What is the concept of ""Do-It-Together"" (DIT) in the maker community?","The concept of ""Do-It-Together"" (DIT) in the maker community emphasizes collaboration and sharing of ideas, tools, and knowledge, rather than working in isolation.",f461769e62f57079e31b939b01e78655
How does the book explain the use of matrices in 3D graphics?,"The book explains the use of matrices in 3D graphics for transformations such as translation, rotation, and scaling of objects in a 3D space.",53688b66c83a8080378f09c7a278e159
"What is the primary focus of the book ""The Power of People""?","The book focuses on how to establish, operate, and lead workforce analytics to improve business performance.",e4f470aa51677533a8101dcc030226b5
How does Google determine a user's 'age' and 'gender'?,"Google determines a user's 'age' and 'gender' through semi-supervised learning, where it develops an averaged web-use model of users who identify as men or women, and assigns a user to a category based on how closely their data stacks up to these models.",e4cffb206209b2e3774124e5cc992b5b
What are data URIs and how can they be used for obfuscation?,"Data URIs are a way to include data in-line in Web pages as if they were external resources. They can be used for obfuscation by embedding encoded payloads directly in the URI, making it harder for filters and parsers to detect malicious content.",7ef5839acfcc562593af3c7d99d53ebd
"What is the main theme of ""The Signals Are Talking"" by Amy Webb?",The main theme of the book is the importance of understanding and forecasting emerging trends in technology and society to better prepare for and shape the future.,987232d753ba0b115444e4fa7d114adf
What are the Seven Forces of Demand that drive the need for workforce analytics?,"The Seven Forces of Demand are desire for a competitive edge, requests coming top down, regulatory requirements, need for operational efficiency, pressure to reduce cost, concerns of a humanistic nature, and HR analytics for the HR function.",e4f470aa51677533a8101dcc030226b5
How does Windows 10 handle multiple desktops?,"Windows 10 allows users to create multiple virtual desktops, each with its own set of running apps, enabling users to group apps together and switch between desktops as needed.",9a5d95792fe412469de0b8393b3fb9b4
What role do 'soft biopolitics' play in the book's narrative?,"'Soft biopolitics' refers to the dynamic, pattern-based abstractions produced by algorithms when processing near real-time data, which become the new, actionable indices for identity itself, influencing how we are seen and treated in various contexts.",e4cffb206209b2e3774124e5cc992b5b
