input,answers,context_id
What are the benefits of using a command-line interface for running SQL statements?,"The benefits include the ability to execute ad hoc SQL statements, develop queries that will eventually be used in applications, and specify the username and password for database access, all while seeing results or error messages immediately.",7a31c4cee86943a2eb9b02f8ade6db6d
What are the three main tasks every business must tackle when doing web analytics?,"The three main tasks are measuring quantitative and qualitative data, continuously improving the website, and aligning the measurement strategy with the business strategy.",81f24ede7be57980985e6348957794e2
What is the role of LibWhisker in the context of Nikto?,"LibWhisker is the Perl module that Nikto relies on for its core functionality. It provides routines for handling HTTP requests, encoding, and other tasks necessary for web vulnerability scanning.",608835cacce8f2da6d1f9e955dbe9a2c
"What is the role of the TimerOne library in Arduino programming, according to the book?","The TimerOne library allows for the generation of timed interrupts, enabling the Arduino to perform tasks at regular intervals without blocking the main loop. It can also be used to generate PWM signals with better control over the duty cycle and frequency.",1ee31b60b19c4c031badacee94f0419a
"Who are the authors of ""The Power of People""?","The authors are Nigel Guenole, Jonathan Ferrar, and Sheri Feinzig.",e4f470aa51677533a8101dcc030226b5
"How does the book critique the notion of ""gamification""?","The book critiques gamification as ""exploitationware,"" highlighting how it manipulates human susceptibility to manipulation by cynical marketers, using game-like elements to encourage behaviors that are lucrative for advertisers.",3c14e08bf5d9f84791cd718d647d6d83
What are the challenges of relying on AWS for critical applications?,"Challenges include potential network connectivity issues, service outages, lack of service level agreements (SLAs) for all services, and the need for careful data security and privacy measures.",62935717ba3d54eef7b8ff426b94d29a
What is the function of the Extensible Authentication Protocol (EAP) in wireless networks?,"EAP is an authentication framework that supports multiple authentication methods, allowing for flexible and extensible security solutions in wireless networks.",25c1cf0fff3e80987d5d7e87df37c2f3
How can themes be customized in WordPress without modifying the core files?,"Themes can be customized using child themes, which inherit styles and functions from a parent theme, allowing for modifications without altering the original theme files.",91def87a41b49240214b80a4560ac4c2
Can the techniques in the book be applied to both static and dynamic web pages?,"Yes, the techniques are versatile and can be applied to both static web pages, where visualizations are pre-rendered, and dynamic web pages, where visualizations are generated on-the-fly based on user interactions or data updates.",775b85e80ceaa0e386ac6549e6d1c221
How does the Bands app handle data persistence?,"The Bands app handles data persistence using `NSUserDefaults`, which allows the app to save and retrieve data such as band information and settings in a simple key-value store.",2c22f0411a56fe5ed3d163bd55f1cba2
What is the significance of the Flotr2 library in the context of the book?,"Flotr2 is significant as it is one of the libraries used to demonstrate the creation of various types of charts and graphs, emphasizing its ease of use and flexibility.",775b85e80ceaa0e386ac6549e6d1c221
How does the book suggest we can resist algorithmic interpretations of our data?,"The book suggests that resistance to algorithmic interpretations involves understanding the layered interaction between offline and online identities, and recognizing the dynamic, modulatory nature of algorithmic categories, which can be contested or capitalized on according to one's power to do so.",e4cffb206209b2e3774124e5cc992b5b
What are Gerber files and why are they important in PCB fabrication?,"Gerber files are industry-standard files used to convey PCB design data to manufacturers, including layers, tracks, pads, and components, ensuring accurate reproduction of the designed PCB.",7df211d1929fe30c218928addb3da81e
"What design principles are considered important for a business blog, according to the book?","The book considers layout, color, typography, and usability and accessibility as important design principles for a business blog. It advises following conventions and standards to ensure that the blog is easy to use and accessible to everyone.",3171e28c5af0984fbc4ffab32c46684e
What is the significance of the BillBoard class in the context of the HUD?,"The BillBoard class is significant in the context of the HUD because it implements a 2D billboarding system, allowing flat rectangular images to face the camera and appear flat, which is useful for HUD elements.",53688b66c83a8080378f09c7a278e159
What are the four pillars of effective devops according to the book?,"The four pillars of effective devops are collaboration, affinity, tools, and scaling.",3c7f2d14b1a259deeb63604651a04697
"What is the primary focus of ""Data Visualization with JavaScript""?","The book focuses on creating effective data visualizations using JavaScript, covering various techniques, libraries, and best practices for presenting data on the web.",775b85e80ceaa0e386ac6549e6d1c221
"What is the significance of the ""devops compact"" mentioned in the book?","The ""devops compact"" is a mutual understanding between teams to work together, communicate their intentions and issues, and dynamically adjust to achieve shared organizational goals.",3c7f2d14b1a259deeb63604651a04697
Who is David Lang and what is his background before becoming a maker?,"David Lang is the author of ""Zero to Maker"" and a former non-maker with a background in office jobs and startups, feeling disconnected from hands-on creation and manual skills.",f461769e62f57079e31b939b01e78655
How does the book address the common myth that DevOps is only for startups?,"The book addresses this myth by highlighting that DevOps practices have been successfully implemented by large organizations such as Google, Amazon, and Netflix, proving that DevOps is applicable to organizations of all sizes.",47f2d1822dbd4242642a16a294e56791
How does the book describe the relationship between algorithms and human cognition?,"The book describes algorithms as influencing human cognition by outsourcing memory, decision-making, and even desire to algorithmic systems, thereby extending the human mind into technological dimensions.",3c14e08bf5d9f84791cd718d647d6d83
What is the role of Data Execution Prevention (DEP) in Windows 10?,"Data Execution Prevention (DEP) in Windows 10 is a security feature that monitors programs to ensure they use only safe and appropriate memory locations, helping to prevent buffer overflow attacks.",9a5d95792fe412469de0b8393b3fb9b4
What is the purpose of EC2 in AWS?,"EC2 allows users to run multiple virtual Linux servers on demand, providing computing power as needed without the need to purchase or rent physical machines.",62935717ba3d54eef7b8ff426b94d29a
What is the purpose of the `figure` and `figcaption` elements?,"The `figure` element represents a self-contained piece of content, such as illustrations, diagrams, and poems, which is referred to from the main content. The `figcaption` element provides a caption or legend for its parent `figure` element.",c84b20f2dc9c88ddafc17b527705a188
What are the key features of the Twenty Thirteen theme in WordPress?,"Key features include a customizable header image, support for custom navigation menus, and multiple widget areas.",91def87a41b49240214b80a4560ac4c2
"What challenges did Markus Persson face when trying to monetize Minecraft, and how did he overcome them?","Markus Persson faced the challenge of setting a price for Minecraft that would be fair to players while also generating revenue. He decided to charge a modest fee during the alpha phase and increase it as the game neared completion, which allowed him to fund development and still attract a large player base.",737c736be7be19e9af3619192070706a
What is the function of gesture recognizers in iOS development?,"Gesture recognizers in iOS development are used to detect and respond to specific user interactions like taps, swipes, and pinches, allowing developers to add interactive elements to views without manually handling touch events.",2c22f0411a56fe5ed3d163bd55f1cba2
How does surface-mount technology (SMT) differ from through-hole technology in PCB design?,"SMT involves soldering components directly to the surface of the PCB, making the components smaller and allowing for more components to be placed on a given area of the board, whereas through-hole technology involves components with leads that are inserted through holes in the board and soldered on the opposite side.",7df211d1929fe30c218928addb3da81e
What is the significance of the SSID in a WLAN?,"The SSID (Service Set ID) is used to identify an extended service set (ESS) or independent basic service set (IBSS), providing a human-friendly name for wireless networks.",25c1cf0fff3e80987d5d7e87df37c2f3
How does VR contribute to empathy and perspective-taking?,"VR contributes to empathy and perspective-taking by allowing users to inhabit and interact with virtual environments and avatars that represent different perspectives or experiences. This immersive experience can help users to better understand and empathize with others, as demonstrated in studies where participants experienced life as an elderly person or a colorblind individual.",d1331b2bd4e259b4870f1a0e95e2bad0
What are the main restrictions of the EAGLE Express Edition for PCB design?,"The main restrictions of the EAGLE Express Edition include a maximum board size of 4 × 3.2 inches, a limit of two layers, and a restriction to two sheets in the Schematic Editor.",7df211d1929fe30c218928addb3da81e
What are some of the design principles emphasized in the book for creating effective visualizations?,"The book emphasizes principles such as simplicity, clarity, and the importance of choosing the right type of chart for the data being presented.",775b85e80ceaa0e386ac6549e6d1c221
What is the purpose of the Wi-Fi Alliance in the wireless technology industry?,The Wi-Fi Alliance promotes Wi-Fi technology and ensures interoperability and quality among Wi-Fi products through product certifications.,25c1cf0fff3e80987d5d7e87df37c2f3
How does S3 differ from traditional storage systems?,"S3 is a web service that provides secure online storage for any kind of data, accessible from anywhere. Unlike traditional storage systems, S3 is highly scalable, distributed, and managed by Amazon, requiring no maintenance from the user.",62935717ba3d54eef7b8ff426b94d29a
"What is the case study blog used throughout the book, and what are its strategic goals?","The case study blog used throughout the book is ChilliGuru, a blog by an expert in the world of chili peppers. Its strategic goals include promoting TV appearances, selling more books, announcing speaking events, getting more speaking engagements, selling chili sauces, building a brand, and getting freelance writing work.",3171e28c5af0984fbc4ffab32c46684e
How can you customize the Start menu in Windows 10?,"Customizing the Start menu in Windows 10 involves rearranging tiles, adding or removing tiles, resizing tiles, working with live tiles, and managing tile groups.",9a5d95792fe412469de0b8393b3fb9b4
How does the book recommend using Wikipedia as a research tool?,"The book recommends using Wikipedia as a research tool by citing it with detailed information such as the exact time, date, and version of the article, along with the direct web address leading to the page. It also suggests using the date of access and the direct URL in the citation.",9596f551be5e415e24d36b48ec543d77
How can Google Analytics be integrated with a CRM system?,"Google Analytics can be integrated with a CRM system by extracting visitor data from Google Analytics cookies using JavaScript, manipulating the data, placing it in hidden form fields, and processing the data using server-side code when the visitor submits a form. This allows for the marketing data, custom variable data, and visit history data to be connected with other information provided by the visitor in the CRM system.",81f24ede7be57980985e6348957794e2
What role does digital fabrication play in the maker movement according to the book?,"Digital fabrication plays a crucial role in the maker movement by providing accessible and powerful tools for prototyping and micro-manufacturing, enabling individuals to turn digital designs into physical objects.",f461769e62f57079e31b939b01e78655
How does Google Analytics contribute to the web analytics process?,"Google Analytics contributes by tracking standard website metrics, business outcomes (goals), marketing initiatives, and providing tools for segmentation and custom reporting to facilitate analysis and continuous improvement of the online experience.",81f24ede7be57980985e6348957794e2
What is the purpose of the Windows Firewall in Windows 10?,"The Windows Firewall in Windows 10 is a security feature that protects the computer from unsolicited network traffic, helping to prevent hacking attempts and malware infections.",9a5d95792fe412469de0b8393b3fb9b4
What is the role of PdDispatcher in libpd-based apps?,"PdDispatcher is a utility class in libpd that implements a publisher-subscriber pattern for routing messages from Pd. It allows developers to register listeners for specific send symbols in Pd, and these listeners implement callback methods to handle messages of different types (e.g., bang, float, symbol, list).",2c4f426048af88ff30f4f7a8def2aff4
What role does JavaScript play in the data visualization techniques discussed in the book?,"JavaScript is central to the techniques discussed, as it is used to create, manipulate, and render visualizations dynamically in the browser.",775b85e80ceaa0e386ac6549e6d1c221
What does Amazon SimpleDB offer as an online database service?,"SimpleDB stores small pieces of textual information in a simple database structure that is easy to manage, modify, and search. It minimizes the complexity and administrative overhead involved in managing data.",62935717ba3d54eef7b8ff426b94d29a
What is the primary characteristic of VR that makes it unique compared to other media experiences?,"The primary characteristic of VR that makes it unique is psychological presence, which is the sensation of ""being there"" in a virtual environment, allowing for seamless interaction with the virtual world similar to how one interacts with the physical world.",d1331b2bd4e259b4870f1a0e95e2bad0
What are the main challenges in Android audio development as discussed in the book?,"The main challenges in Android audio development, as discussed in the book, include high latency, device fragmentation, varying audio capabilities across different devices, and the need to test on actual devices due to limitations of the Android emulator.",2c4f426048af88ff30f4f7a8def2aff4
What are the three technical elements that must be executed flawlessly to create presence in VR?,"The three technical elements that must be executed flawlessly to create presence in VR are tracking, rendering, and display. Tracking measures body movements, rendering updates the virtual environment based on these movements, and display delivers the updated visuals and sounds to the user.",d1331b2bd4e259b4870f1a0e95e2bad0
What is the importance of diversity in a devops environment as per the book?,"Diversity is important in a devops environment because it enhances creativity, problem-solving, and innovation. Diverse teams can develop products that cater to a wider customer base and perform better due to varied perspectives and experiences.",3c7f2d14b1a259deeb63604651a04697
What is The Loop in WordPress and why is it important?,The Loop is a PHP function used to display posts and pages on a WordPress site. It is crucial as it determines how content is presented and repeated for each post.,91def87a41b49240214b80a4560ac4c2
What is the significance of the Android Activity Life Cycle?,"The Android Activity Life Cycle is significant because it defines the various states an activity goes through, from creation to destruction, and provides callbacks that allow developers to manage transitions between these states.",53688b66c83a8080378f09c7a278e159
How does the autorouter feature in EAGLE assist in PCB design?,"The autorouter in EAGLE automatically routes the connections between components on a PCB, saving time and effort in manually laying out the tracks, though it may require tweaking for optimal results.",7df211d1929fe30c218928addb3da81e
How does the book describe the process of writing and releasing an Arduino library?,"The book describes the process of writing an Arduino library by defining the API, writing the header and implementation files, creating a keywords file, and making examples. It also explains how to release the library by testing it, creating a zip file, registering on the Arduino Playground, and adding an entry with a description and download link.",1ee31b60b19c4c031badacee94f0419a
What is the Eight Step Model for Purposeful Analytics introduced in the book?,"The Eight Step Model for Purposeful Analytics includes framing business questions, building hypotheses, gathering data, conducting analyses, revealing insights, determining recommendations, getting the point across, and implementing and evaluating.",e4f470aa51677533a8101dcc030226b5
"How does the book ""SQL Hacks"" aim to reclaim the term 'hacking'?","The book aims to reclaim the term 'hacking' by documenting positive and creative ways people use SQL, promoting the idea of hacking as a compliment for being creative and technically proficient.",7a31c4cee86943a2eb9b02f8ade6db6d
What is the paradox of the present and how does it affect our ability to forecast the future?,The paradox of the present is our inability to see the future clearly due to our present circumstances and biases. It hampers our ability to recognize and adapt to new trends and technologies.,987232d753ba0b115444e4fa7d114adf
What are the five infrastructure services discussed in the book?,"The five infrastructure services are Amazon Simple Storage Service (S3), Amazon Elastic Compute Cloud (EC2), Amazon Simple Queue Service (SQS), Amazon Flexible Payments Service (FPS), and Amazon SimpleDB.",62935717ba3d54eef7b8ff426b94d29a
What are the benefits of adopting Lean principles in DevOps according to the book?,"Adopting Lean principles in DevOps helps in improving flow, reducing waste, and creating value for customers by focusing on small batch sizes, reducing work in process, and eliminating rework.",47f2d1822dbd4242642a16a294e56791
How does SQS facilitate communication between components of a distributed application?,"SQS delivers short messages between any computers or systems with Internet access, allowing components of distributed applications to communicate reliably without building or maintaining a custom messaging system.",62935717ba3d54eef7b8ff426b94d29a
Who is Amy Webb and what is her background?,"Amy Webb is a futurist and the founder of the Future Today Institute. She researches emerging technology and forecasts trends for a living, with a background in journalism, strategic planning, and digital media.",987232d753ba0b115444e4fa7d114adf
How does David Lang describe the transition from being a passive consumer to an engaged creator?,"David Lang describes the transition from being a passive consumer to an engaged creator as a fundamental shift in mindset and lifestyle, involving hands-on learning, overcoming fears, and embracing the maker mentality.",f461769e62f57079e31b939b01e78655
What JavaScript libraries are discussed in the book?,"The book discusses several JavaScript libraries, including Flotr2, Flot, jQuery sparklines, and D3.js, among others.",775b85e80ceaa0e386ac6549e6d1c221
"What are some common Web attacks discussed in the book, and how are they related to obfuscation techniques?","Common Web attacks discussed include cross-site scripting (XSS), SQL injection, and command injection. These attacks are related to obfuscation techniques as the book demonstrates how attackers can use obfuscation to bypass security measures and execute malicious code.",7ef5839acfcc562593af3c7d99d53ebd
What are the new input types introduced in HTML5?,"The new input types in HTML5 include `color`, `date`, `datetime`, `datetime-local`, `email`, `month`, `number`, `range`, `search`, `tel`, `time`, `url`, and `week`.",c84b20f2dc9c88ddafc17b527705a188
"How does the book define the term ""devops""?","The book defines ""devops"" as a cultural movement that changes how individuals think about their work, values the diversity of work done, supports intentional processes that accelerate the rate by which businesses realize value, and measures the effect of social and technical change.",3c7f2d14b1a259deeb63604651a04697
How does AWS ensure data security and privacy?,"AWS uses industry-standard mechanisms for user authentication and secure transmission. For sensitive data, users must encrypt information before transmission or storage to ensure secure storage.",62935717ba3d54eef7b8ff426b94d29a
What role does technology play in the trends discussed in the book?,"Technology is a central driver of the trends discussed in the book, as it enables new behaviors, disrupts existing industries, and creates opportunities for innovation and transformation across society.",987232d753ba0b115444e4fa7d114adf
What is the definition of workforce analytics provided in the book?,"Workforce analytics is defined as the discovery, interpretation, and communication of meaningful patterns in workforce-related data to inform decision making and improve performance.",e4f470aa51677533a8101dcc030226b5
How does the book suggest reducing power consumption in Arduino projects?,"The book suggests several methods to reduce power consumption in Arduino projects, such as reducing the clock speed, turning off unnecessary components, using sleep modes, and employing low-power libraries like Narcoleptic.",1ee31b60b19c4c031badacee94f0419a
What is the importance of storytelling and visualization in communicating workforce analytics results?,"Storytelling and visualization are important because they help in making complex data understandable and relatable, thereby enhancing the impact of the insights and recommendations.",e4f470aa51677533a8101dcc030226b5
What is the significance of MEMS sensors in the evolution of sensor technology?,"MEMS sensors have led to the availability of small, accurate sensors at a price point that made it feasible to integrate them into a wide variety of devices, ranging from sports watches to consumer electronics to cars.",547951ad663b0f33d55b833e85aaf6c2
What is the role of the GLSurfaceView class in Android OpenGL ES applications?,The GLSurfaceView class is a customized version of the SurfaceView class that provides the necessary framework for OpenGL ES graphics rendering.,53688b66c83a8080378f09c7a278e159
What is the significance of the OpenROV project in David Lang's maker journey?,"The OpenROV project is significant in David Lang's maker journey as it represents a collaborative, open-source initiative that allowed him to apply his newly acquired skills and contribute to a larger exploration and engineering effort.",f461769e62f57079e31b939b01e78655
What are REST and Query APIs in the context of AWS?,"REST and Query are two interfaces provided by AWS services to interact with them. REST uses standard HTTP methods to describe actions, while Query uses parameters to specify actions, making it accessible via standard web browsers.",62935717ba3d54eef7b8ff426b94d29a
What is the significance of the 'Data Wars' mentioned in the book?,"The 'Data Wars' signify the competitive acquisition of data by major tech companies like Google, Microsoft, and Yahoo, aiming to grow from mere search engines into profitable advertising behemoths capable of providing targeted commercial propaganda.",e4cffb206209b2e3774124e5cc992b5b
"What is the role of automated testing in DevOps according to ""The DevOps Handbook""?","Automated testing plays a crucial role in DevOps by ensuring that code changes do not introduce defects, enabling fast feedback, and maintaining a deployable state at all times.",47f2d1822dbd4242642a16a294e56791
"What is the significance of the I2C protocol in Arduino programming, as discussed in the book?","The I2C protocol allows microcontrollers and peripherals to communicate with a minimal number of data lines, simplifying the connection of multiple devices to a master device like the Arduino. It is significant for its ability to greatly reduce the number of interface pins needed for communication with modules and components.",1ee31b60b19c4c031badacee94f0419a
What role do semiconductor sensors play in environmental monitoring?,"Semiconductor sensors are used to detect and measure various environmental parameters such as gases, pollutants, and temperature. They are crucial in monitoring air quality, water quality, and other environmental conditions.",547951ad663b0f33d55b833e85aaf6c2
How does the book suggest filtering rows and columns in SQL to minimize database traffic?,"The book suggests explicitly asking for only the columns you need in your SELECT statement and using WHERE clauses to filter rows based on specific conditions, thus reducing the amount of data transferred between the database and your application.",7a31c4cee86943a2eb9b02f8ade6db6d
